,sentence,subject_entity,object_entity,label
229,1994년 우크라이나는 핵무기를 포기하는 대신 크림 반도를 포함한 ‘영토 보전’과 ‘주권 보장’ ‘경제적 지원’ 등을 국제적으로 약속받았다.,"{'word':'우크라이나','start_idx':6,'end_idx':10,'type':'ORG'}","{'word':'핵무기','start_idx':13,'end_idx':15,'type':'POH'}",org:property
230,볼로디미르 젤렌스키는 문법학교에 입학하기 이전에 4년 동안 아버지가 일하던 몽골 에르데네트에 거주했다.,"{'word':'에르데네트','start_idx':45,'end_idx':49,'type':'ORG'}","{'word':'몽골','start_idx':42,'end_idx':43,'type':'ORG'}",org:member_of
231,"핵폭탄을 제조할 시설도 없다.""고 말했다.","{'word':'시설','start_idx':9,'end_idx':10,'type':'ORG'}","{'word':'핵폭탄','start_idx':0,'end_idx':2,'type':'POH'}",no_relation
232,러시아-우크라이나 관계는 러시아 연방과 우크라이나의 관계를 말한다.,"{'word':'러시아','start_idx':0,'end_idx':2,'type':'ORG'}","{'word':'우크라이나','start_idx':4,'end_idx':8,'type':'ORG'}",no_relation
233,이 협정은 유럽 안보 협력 기구(OSCE)의 중재 아래 벨라루스의 민스크에서 서명했다.,"{'word':'유럽 안보 협력 기구','start_idx':6,'end_idx':16,'type':'ORG'}","{'word':'OSCE','start_idx':18,'end_idx':21,'type':'ORG'}",org:alternate_names
234,북대서양 조약 기구가 주도하는 국제안보지원군이 아프가니스탄에 파병된 것이었다.,"{'word':'북대서양 조약 기구','start_idx':0,'end_idx':9,'type':'ORG'}","{'word':'국제안보지원군','start_idx':17,'end_idx':23,'type':'ORG'}",org:property
235,북아시아 전체와 동유럽의 대부분에 11개의 시간대에 걸친 영토가 있다.,"{'word':'북아시아','start_idx':0,'end_idx':3,'type':'ORG'}","{'word':'동유럽','start_idx':9,'end_idx':11,'type':'ORG'}",no_relation
236,그의 아버지인 올렉산드르 젤렌스키는 크리비리흐 경제 연구소에서 사이버 네트워크 및 컴퓨터 하드웨어학과 교수로 근무했으며 그의 어머니인 림마 젤렌스카는 공학자로 활동했다.,"{'word':'올렉산드르 젤렌스키','start_idx':8,'end_idx':17,'type':'PER'}","{'word':'교수','start_idx':57,'end_idx':58,'type':'POH'}",per:title
237,1999년 8월 16일에는 보리스 옐친 러시아 연방 대통령으로부터 러시아 연방의 총리로 임명되었으며 그 해 12월 31일 보리스 니콜라예비치 옐친 초대 러시아 연방 대통령이 사임하면서 러시아 총리로서 러시아 연방 대통령직을 대행했다.,"{'word':'보리스 옐친','start_idx':15,'end_idx':20,'type':'PER'}","{'word':'대통령','start_idx':29,'end_idx':31,'type':'POH'}",per:title
238,슬로비드스카 거리 6번가와 센트럴 애브뉴의 코라벨니니 라이온에서 대규모 전투가 벌어졌다.,"{'word':'코라벨니니 라이온','start_idx':24,'end_idx':32,'type':'ORG'}","{'word':'센트럴 애브뉴','start_idx':15,'end_idx':21,'type':'ORG'}",org:member_of
239,"5월 6일 약 8,000~20,000명의 시위자들이 모스크바 연방시에 모였으며 80명이 러시아 경찰과 직면하면서 부상을 당하고 450명이 체포되었으며, 다음 날에 다른 120명이 체포되었다.","{'word':'시위자들','start_idx':23,'end_idx':26,'type':'PER'}","{'word':'모스크바 연방시','start_idx':29,'end_idx':36,'type':'ORG'}",no_relation
240,드니프로페트로우스크주 크리비리흐에서 유대인 부모의 아들로 태어났다.,"{'word':'크리비리흐','start_idx':12,'end_idx':16,'type':'ORG'}","{'word':'드니프로페트로우스크주','start_idx':0,'end_idx':10,'type':'ORG'}",org:member_of
241,"기근의 원인으로 당시 학자들은 자연적 요인, 경제 정책이나 소련의 지도자들의 농장 파괴 등으로 꼽아 학자들끼리도 의견이 엇갈렸다.","{'word':'농장 파괴','start_idx':43,'end_idx':47,'type':'EVE'}","{'word':'지도자들','start_idx':37,'end_idx':40,'type':'PER'}",no_relation
242,푸틴은 1994년부터 1996년까지 상트페테르부르크 시청에서 여러 직책을 역임했다.,"{'word':'상트페테르부르크 시청','start_idx':20,'end_idx':30,'type':'ORG'}","{'word':'푸틴','start_idx':0,'end_idx':1,'type':'PER'}",org:top_members/employees
243,"동유럽의 동슬라브 원주민들은 5세기부터 투르크 민족 국가인 사바르 카간국의 동유럽 정벌에 의해 튀르크의 지배하에 있었고 그 후에는 러시아인, 벨라루스인 그리고 우크라이나인들이 아바르 카간국에 정복되었다.","{'word':'동슬라브 원주민들','start_idx':5,'end_idx':13,'type':'ORG'}","{'word':'사바르 카간국','start_idx':33,'end_idx':39,'type':'ORG'}",org:member_of
244,"1994년 12월 5일 벨라루스, 카자흐스탄, 우크라이나, 러시아, 미국, 영국이 서명하여, 헝가리 부다페스트에서 체결되었다.","{'word':'부다페스트','start_idx':56,'end_idx':60,'type':'ORG'}","{'word':'헝가리','start_idx':52,'end_idx':54,'type':'ORG'}",org:member_of
245,"볼로디미르 올렉산드로비치 젤렌스키(, 1978년 1월 25일 ~ )는 우크라이나의 제6대 대통령이다.","{'word':'볼로디미르 올렉산드로비치 젤렌스키','start_idx':0,'end_idx':17,'type':'PER'}","{'word':'제6대 대통령','start_idx':46,'end_idx':52,'type':'POH'}",per:title
246,1991년에 나토는 유럽에 대한 핵무기 공급을 80% 줄일 것이라고 발표했다.,"{'word':'유럽','start_idx':11,'end_idx':12,'type':'ORG'}","{'word':'나토','start_idx':7,'end_idx':8,'type':'ORG'}",no_relation
247,"또한 루간스크 당국자는 러시아 연방의 일부가 되거나, 한편으로 도네츠크와 연합하여 노보로시야를 형성하려는 희망을 밝혔다.","{'word':'도네츠크','start_idx':35,'end_idx':38,'type':'ORG'}","{'word':'루간스크','start_idx':3,'end_idx':6,'type':'ORG'}",no_relation
248,"1997년 12월 16일, 우크라이나는 SS-19 ICBM 68기와 ICBM 발사대 107대를 이미 폐기했다고 니콜라이 곤차렌코 우크라이나 군사력조사본부장이 밝혔다.","{'word':'니콜라이 곤차렌코','start_idx':62,'end_idx':70,'type':'PER'}","{'word':'군사력조사본부장','start_idx':78,'end_idx':85,'type':'POH'}",per:title
249,"일명 ‘부다페스트 조약’이다. 하지만 이번 사태에서, 조약에 서명한 미국, 영국 등 서방국가들은 아무런 연합군 파병을 하지 않았다.","{'word':'부다페스트 조약','start_idx':4,'end_idx':11,'type':'EVE'}","{'word':'서방국가들','start_idx':47,'end_idx':51,'type':'ORG'}",no_relation
250,통합 러시아 당의 승리는 당시 러시아 연방의 지도력과 정책들의 강한 인기있는 후원의 표시로 보였다.,"{'word':'러시아 연방','start_idx':17,'end_idx':22,'type':'ORG'}","{'word':'통합 러시아 당','start_idx':0,'end_idx':7,'type':'ORG'}",org:member_of
251,"소련은 제2차 세계대전에 참전하여 연합국의 승리에 지대한 영향을 끼쳤으며, 이후 미국과 함께 강대국으로 떠올라 냉전 시기 동안 미국의 자본주의 진영과 함께 대립을 지속하였다.","{'word':'제2차 세계대전','start_idx':4,'end_idx':11,'type':'EVE'}","{'word':'소련','start_idx':0,'end_idx':1,'type':'ORG'}",no_relation
252,미국은 이 과정에서 경제 지원을 담당했다.,"{'word':'미국','start_idx':0,'end_idx':1,'type':'ORG'}","{'word':'경제 지원','start_idx':11,'end_idx':15,'type':'ORG'}",no_relation
253,"당시 블라디미르 푸틴 러시아 연방 대통령이 정교회 성화상을 김정일 조선로동당 총비서 겸 조선민주주의인민공화국 국방위원회 위원장에게 선물하면서 성화상을 모실 교회를 만들어달라고 요청했고, 조선민주주의인민공화국에서 이를 수락하면서 평양에 정교회 정백성당이 세워졌다고 한다.","{'word':'김정일','start_idx':33,'end_idx':35,'type':'PER'}","{'word':'위원장','start_idx':67,'end_idx':69,'type':'POH'}",per:title
254,올렉산드르 스타루흐 현지 주지사는 포탄이 아파트 건물을 강타하고 시가전이 격렬하게 벌어졌다고 전했다.,"{'word':'올렉산드르 스타루흐','start_idx':0,'end_idx':9,'type':'PER'}","{'word':'주지사','start_idx':14,'end_idx':16,'type':'POH'}",per:title
255,러시아-우크라이나 전쟁 중 2014년 2월 말부터 시작된 러시아의 우크라이나 침공 이후,"{'word':'러시아','start_idx':32,'end_idx':34,'type':'ORG'}","{'word':'우크라이나','start_idx':37,'end_idx':41,'type':'ORG'}",org:hostile
256,"바르샤바 조약 기국가 붕괴된 후, 나토는 나토 회원국뿐만 아니라 이전에 바르샤바조약을 체결한 나라들도 포함하는 북대서양협력회의를 결성했다.","{'word':'바르샤바조약','start_idx':40,'end_idx':45,'type':'EVE'}","{'word':'나토','start_idx':19,'end_idx':20,'type':'ORG'}",no_relation
257,"겐나디 팀첸코, 블라디미르 야쿠닌, 유리 코발추크, 세르게이 체메조프 같은 새로운 비지니스 부호들도 블라디미르 푸틴 대통령에게 가까운 인연과 함께 드러났다.","{'word':'블라디미르 푸틴','start_idx':56,'end_idx':63,'type':'PER'}","{'word':'비지니스 부호들','start_idx':46,'end_idx':53,'type':'PER'}",no_relation
258,우크라이나 혁명 이후 우크라이나 정부는 유럽 연합과 러시아 사이의 중립 외교를 계속하기보다는 유럽 연합과 북대서양 조약 기구(NATO)에 참여하려고 하였다.,"{'word':'북대서양 조약 기구','start_idx':59,'end_idx':68,'type':'ORG'}","{'word':'NATO','start_idx':70,'end_idx':73,'type':'ORG'}",org:alternate_names
259,"2014년 루한스크 반란 와중에, 2014년 4월 27일 우크라이나 친러 시위대 수백명이 루한스크 중심가에 모여 '루간스크 인민 공화국 주권 선언서'를 채택ㆍ발표하면서 독립을 선포한 공화국이다.","{'word':'루한스크 반란','start_idx':6,'end_idx':12,'type':'EVE'}","{'word':'2014년','start_idx':0,'end_idx':4,'type':'DAT'}",eve:date
260,"이후에도 러시아는 북대서양 조약 기구(나토, NATO)의 확장,","{'word':'북대서양 조약 기구','start_idx':10,'end_idx':19,'type':'ORG'}","{'word':'NATO','start_idx':25,'end_idx':28,'type':'ORG'}",org:alternate_names
261,"그 결과 81%의 유권자가 참여, 잠정집계 결과 96.2%가 찬성하였다.","{'word':'잠정집계','start_idx':19,'end_idx':22,'type':'EVE'}","{'word':'유권자','start_idx':10,'end_idx':12,'type':'PER'}",no_relation
262,"뉴욕 타임즈에서는 높은 민간인 사망자 비율이 ""동우크라이나에서 친서방 우크라이나 정부를 반대하는 인구를 줄이는 데 사용하고 있으며"", 이 감정이 저항세력에 대한 ""모집을 지지하는 계기가 될 것""이라고 말했다.","{'word':'동우크라이나','start_idx':26,'end_idx':31,'type':'ORG'}","{'word':'친서방 우크라이나 정부','start_idx':35,'end_idx':46,'type':'ORG'}",org:hostile
263,자포리자주 주지사 올렉산드르 스타루흐는 이 도시에서 지역 방위군과의 총격전이 여전히 계속되고 있다고 말했다.,"{'word':'올렉산드르 스타루흐','start_idx':10,'end_idx':19,'type':'PER'}","{'word':'주지사','start_idx':6,'end_idx':8,'type':'POH'}",per:title
264,"조선민주주의인민공화국이 우크라이나로부터 빼내려 했던 문서는 R-36M과 연관된 첨단 로켓 기술과 우주선, 액체 연료 로켓 엔진, 연료 공급 시스템 등에 관한 논문들이었던 것으로 알려졌다.","{'word':'우크라이나','start_idx':13,'end_idx':17,'type':'ORG'}","{'word':'첨단 로켓 기술','start_idx':44,'end_idx':51,'type':'POH'}",org:property
265,"2002년 모스크바 극장 인질극이 일어난 동안에 러시아의 신문과 국제 대중 매체의 많은 이들은 특수 부대들의 구출 작전에서 130명의 인질들의 사망이 푸틴 러시아 대통령의 인기를 심하게 손상시킬 것이라고 경고하였다. 하지만, 포위 공격이 끝난 후 곧 러시아 국민들의 83%가 블라디미르 푸틴 대통령과 그의 테러리스트에 대한 완강함에 흡족해 하였으며 이는 곧 푸틴 대통령의 지지율 향상을 불러오게 된다.","{'word':'모스크바 극장 인질극','start_idx':6,'end_idx':16,'type':'EVE'}","{'word':'2002년','start_idx':0,'end_idx':4,'type':'DAT'}",eve:date
266,안나 스테파노브나 폴리트콥스카야의 사망은 푸틴 대통령이 국가의 새로운 독립적 대중 매체에 계획을 실패한 고발과 함께 서방의 대중 매체에서 부르짖음을 일으켰다.,"{'word':'안나 스테파노브나 폴리트콥스카야','start_idx':0,'end_idx':16,'type':'PER'}","{'word':'푸틴','start_idx':23,'end_idx':24,'type':'PER'}",no_relation
267,"차후 푸틴 대통령은 나중에 자신의 결정을 설명하였는데, 선택이 어려웠지만 장기적으로 생각하는 것이 그의 삶의 가장 중요한 부분이라고 생각했기 때문에, ""군사쿠데타를 시작하면서, 나는 내가 있던 반대하는 방향으로 결정""했다고 말했다.","{'word':'군사쿠데타','start_idx':85,'end_idx':89,'type':'EVE'}","{'word':'푸틴','start_idx':3,'end_idx':4,'type':'PER'}",no_relation
268,러시아 정부는 호도르콥스키가 불로 소득세에 세금을 매기고 조세 피난처를 문 닫는 등 세금 암호를 막으려고 국가원의 큰 부분을 타락시키고 있었다고 말하였다.,"{'word':'호도르콥스키','start_idx':8,'end_idx':13,'type':'PER'}","{'word':'국가원','start_idx':59,'end_idx':61,'type':'ORG'}",no_relation
269,2000년 5월 7일 취임식을 올린 블라디미르 푸틴 대통령은 러시아 연방 재정부 장관 미하일 카시야노프를 러시아 연방 정부주석으로 임명하였다.,"{'word':'미하일 카시야노프','start_idx':48,'end_idx':56,'type':'PER'}","{'word':'장관','start_idx':45,'end_idx':46,'type':'POH'}",per:title
270,푸틴 대통령은 1952년 10월 7일에 소련 레닌그라드에서 태어났다.,"{'word':'푸틴','start_idx':0,'end_idx':1,'type':'PER'}","{'word':'대통령','start_idx':3,'end_idx':5,'type':'POH'}",per:title
271,우크라이나와 러시아의 두 번째 갈등은 흑해 함대와 세바스토폴에 관한 것이었다.,"{'word':'우크라이나','start_idx':0,'end_idx':4,'type':'ORG'}","{'word':'러시아','start_idx':7,'end_idx':9,'type':'ORG'}",org:hostile
272,또한 돈바스 전쟁에서는 우크라이나 정부군을 지지했다.,"{'word':'돈바스 전쟁','start_idx':3,'end_idx':8,'type':'EVE'}","{'word':'우크라이나','start_idx':13,'end_idx':17,'type':'ORG'}",no_relation
273,같은 날 블라디미르 푸틴 대통령이 러시아와 크림 공화국 합병 조약에 최종 서명하여 크림 공화국 합병을 위한 법적인 절차는 마무리되었다.,"{'word':'블라디미르 푸틴','start_idx':5,'end_idx':12,'type':'PER'}","{'word':'대통령','start_idx':14,'end_idx':16,'type':'POH'}",per:title
274,총리 2기 재직 (2008년 ~ 2012년).,"{'word':'총리 2기 재직','start_idx':0,'end_idx':7,'type':'EVE'}","{'word':'2008년','start_idx':10,'end_idx':14,'type':'DAT'}",eve:date
275,"방위 범위는 영국·프랑스·포르투갈을 제외한 서유럽 전역과 영국영공이며, 전시에는 최고사령관이 유럽 지역의 육·해·공 3군이 작전권을 행사하였다.","{'word':'최고사령관','start_idx':45,'end_idx':49,'type':'PER'}","{'word':'유럽','start_idx':52,'end_idx':53,'type':'ORG'}",no_relation
276,2008년부터 2012년까지는 드미트리 메드베데프 밑에서 총리로 재직하면서 대규모 군사개혁과 경찰개혁을 주도했다.,"{'word':'드미트리 메드베데프','start_idx':17,'end_idx':26,'type':'EVE'}","{'word':'총리','start_idx':32,'end_idx':33,'type':'POH'}",no_relation
277,3월 21일에는 러시아 연방 상원인 러시아 연방평의회 역시 합병 조약을 심의한 결과 회의에 참석한 의원 155명 전원이 크림 공화국 합병 조약 비준안에 전원 찬성표를 던졌다.,"{'word':'러시아 연방평의회','start_idx':20,'end_idx':28,'type':'ORG'}","{'word':'러시아 연방','start_idx':9,'end_idx':14,'type':'ORG'}",org:member_of
278,"현지 시간으로 18시 30분 경, 전차가 도시 외곽에 위치해 있고 시장은 시민들에게 창문에서 가능한 한 멀리 떨어진 채로 집에 머물 것을 명령했다.","{'word':'시장','start_idx':37,'end_idx':38,'type':'PER'}","{'word':'시민들','start_idx':41,'end_idx':43,'type':'PER'}",no_relation
279,2014년 11월 2일 돈바스 지역 자체선거가 있었다.,"{'word':'돈바스 지역 자체선거','start_idx':13,'end_idx':23,'type':'EVE'}","{'word':'2014년 11월 2일','start_idx':0,'end_idx':11,'type':'DAT'}",eve:date
280,"2014년 우크라이나 혁명이 일어나자, 푸틴 대통령은 러시아군을 우크라이나로부터 크림 반도를 포착하는 명령을 내렸다.","{'word':'우크라이나 혁명','start_idx':6,'end_idx':13,'type':'EVE'}","{'word':'2014년','start_idx':0,'end_idx':4,'type':'DAT'}",eve:date
281,"리태길, 류성철은 2011년 7월 우크라이나 로켓산업의 중심지였던 드니프로의 한 차고에서 미사일 전문가로부터 건네받은 가짜 기밀을 촬영하다 몰래카메라로 이들을 살피던 정보당국 요원에 의해 검거됐으며 이후 재판에서 각각 8년형을 선고받았다.","{'word':'드니프로','start_idx':37,'end_idx':40,'type':'ORG'}","{'word':'우크라이나','start_idx':19,'end_idx':23,'type':'ORG'}",org:member_of
282,"1997년, 우크라이나의 수출 중에서 약 26.2%가 러시아였는데, 1998년-2000년에 23%로 감소하였다.","{'word':'러시아','start_idx':30,'end_idx':32,'type':'ORG'}","{'word':'우크라이나','start_idx':7,'end_idx':11,'type':'ORG'}",no_relation
283,"러시아는 유엔안전보장이사회의 영구 회원국이자, G20, 유럽 위원회, APEC, OSCE, IIB, WTO의 일원이며 CIS, CSTO, EAEU를 주도하는 국가이기도 하다.","{'word':'러시아','start_idx':0,'end_idx':2,'type':'ORG'}","{'word':'유엔안전보장이사회','start_idx':5,'end_idx':13,'type':'ORG'}",org:member_of
284,나토는 1992년에 소속군이 유럽의 비회원국들에게 평화유지 지원을 할 수 있도록 함으로써 군사적인 역할이 커지도록 했다.,"{'word':'나토','start_idx':0,'end_idx':1,'type':'ORG'}","{'word':'비회원국들','start_idx':20,'end_idx':24,'type':'ORG'}",org:friendly
285,2000년과 2004년 사이에 푸틴 대통령은 권력 투쟁에 승리하게 되었다.,"{'word':'푸틴','start_idx':17,'end_idx':18,'type':'PER'}","{'word':'대통령','start_idx':20,'end_idx':22,'type':'POH'}",per:title
286,"그러나, 우크라이나에서 빅토르 유셴코가 집권하면서 이러한 시도는 물거품이 되었고, 우크라이나의 북대서양 조약 기구와 유럽 연합 참여 시도는 두 국가 사이의 관계를 크게 나빠지게 만들었다.","{'word':'우크라이나','start_idx':5,'end_idx':9,'type':'ORG'}","{'word':'빅토르 유셴코','start_idx':13,'end_idx':19,'type':'PER'}",org:top_members/employees
287,2014년 우크라이나 혁명이 일어나자 러시아는 우크라이나에게 경제적으로 중요하고 러시아인이 많이 거주하는 도네츠크의 도네츠크 인민공화국과 루간스크의 루간스크 인민공화국을 지원하여 돈바스 전쟁이 일어나게 하였다.,"{'word':'우크라이나 혁명','start_idx':6,'end_idx':13,'type':'EVE'}","{'word':'2014년','start_idx':0,'end_idx':4,'type':'DAT'}",eve:date
288,"소련이 붕괴되기 전에, 소련에서 서유럽으로 향하는 많은 석유, 가스 파이프라인은 현 우크라이나 지역을 통과했다.","{'word':'소련','start_idx':13,'end_idx':14,'type':'ORG'}","{'word':'가스 파이프라인','start_idx':35,'end_idx':42,'type':'POH'}",org:property
289,"부인 류드밀라 여사도 ""대중 앞에 서는 게 싫었다.","{'word':'류드밀라','start_idx':3,'end_idx':6,'type':'PER'}","{'word':'여사','start_idx':8,'end_idx':9,'type':'POH'}",per:title
290,"푸틴은 여러 부문에서 발전을 추구했는데, 여기에는 파이프라인 건설, 위성 항법 시스템 글로나스 복원, 2014년 소치 동계 올림픽과 같은 국제 행사를 치를 수 있는 인프라 구축이 포함되었다.","{'word':'소치 동계 올림픽','start_idx':63,'end_idx':71,'type':'EVE'}","{'word':'2014년','start_idx':57,'end_idx':61,'type':'DAT'}",eve:date
291,ACLANT는 상비병력은 없지만 훈련시·전시에는 회원국 해군이 전속되었다.,"{'word':'ACLANT','start_idx':0,'end_idx':5,'type':'ORG'}","{'word':'회원국','start_idx':27,'end_idx':29,'type':'ORG'}",org:friendly
292,이전에 예상했던 추측치보다 훨씬 큰 이 수는 유엔 난민 고등판무관 사무소에 넘겨졌다.,"{'word':'난민 고등판무관 사무소','start_idx':28,'end_idx':39,'type':'ORG'}","{'word':'유엔','start_idx':25,'end_idx':26,'type':'ORG'}",org:member_of
293,"본래 희극배우 겸 배우 출신으로, 청렴하고 공정한 대통령 역할을 맡았던 '국민의 일꾼' 이라는 드라마가 흥행하며 전국민적인 인기를 얻게 되었고 이를 발판 삼아 정치 경력이 전무함에도 대통령에 당선되었다.","{'word':'국민의 일꾼','start_idx':41,'end_idx':46,'type':'ORG'}","{'word':'대통령','start_idx':28,'end_idx':30,'type':'POH'}",no_relation
294,인위적인 기근이라는 문서상 근거가 없는 상황에서 이 대기근은 소련과 카자흐스탄 전 지역으로 퍼져나갔다.,"{'word':'소련','start_idx':34,'end_idx':35,'type':'ORG'}","{'word':'카자흐스탄','start_idx':38,'end_idx':42,'type':'ORG'}",no_relation
295,"휴먼 라이츠 워치는 우크라이나 정부 세력인 친우크라이나 민병대와 반정부군이 민간인 지역에 무유도 BM-21을 이용한 로켓 공격을 했다고 보고하면서, ""인구 밀집 지역의 무차별 로켓 사용은 국제 인도주의 법과 전쟁법을 위반한 전쟁 범죄이다.""라고 말했다.","{'word':'친우크라이나 민병대','start_idx':24,'end_idx':33,'type':'ORG'}","{'word':'무유도 BM-21','start_idx':50,'end_idx':58,'type':'POH'}",org:property
296,푸틴은 레닌그라드 (현 상트페테르부르크)에서 태어나 1975년에 졸업한 국립 레닌그라드 대학교에서 법학을 전공했다.,"{'word':'국립 레닌그라드 대학교','start_idx':40,'end_idx':51,'type':'ORG'}","{'word':'레닌그라드','start_idx':4,'end_idx':8,'type':'ORG'}",org:member_of
297,"5월 28일, 분리주의 지도자 발레리 볼로토프는 러시아 연방법을 기본으로 한 자체적 법률 체계의 도입을 시작할 것이라고 밝혔다. ""올리가르히들이 쓴"" 우크라이나의 법률은 부적절하기 때문이라고 한다.","{'word':'발레리 볼로토프','start_idx':17,'end_idx':24,'type':'PER'}","{'word':'지도자','start_idx':13,'end_idx':15,'type':'POH'}",per:title
298,"도네츠크 인민 공화국과 루간스크 인민 공화국이 협정을 어기며 총선을 열고 선거 운동을 진행할 때, 자하르첸코는 ""이는 우리가 새로운 나라를 만들 역사적 시간이다.","{'word':'자하르첸코','start_idx':55,'end_idx':59,'type':'ORG'}","{'word':'루간스크 인민 공화국','start_idx':13,'end_idx':23,'type':'ORG'}",no_relation
299,자발적 비핵화를 한 우크라이나가 러시아의 핵공격 위협을 포함한 침공에 크림 반도를 병합당하자 이 사례가 조선민주주의인민공화국이 비핵화를 하지 않는 이유가 될 수 있다는 평가다.,"{'word':'조선민주주의인민공화국','start_idx':58,'end_idx':68,'type':'ORG'}","{'word':'우크라이나','start_idx':11,'end_idx':15,'type':'ORG'}",no_relation
300,"블라디미르 블라디미로비치 푸틴(, , 1952년 10월 7일 ~ )은 러시아의 제2·4대 대통령이다.","{'word':'블라디미르 블라디미로비치 푸틴','start_idx':0,'end_idx':15,'type':'PER'}","{'word':'제2·4대 대통령','start_idx':44,'end_idx':52,'type':'POH'}",per:title
301,우크라이나에서 러시아에 대한 인식은 지역에 따라 크게 다르다.,"{'word':'러시아','start_idx':8,'end_idx':10,'type':'ORG'}","{'word':'우크라이나','start_idx':0,'end_idx':4,'type':'ORG'}",no_relation
302,2012년 이내로 살인자들이 체포되고 보리스 베레조프스키와 아흐메드 자카예프를 가능한 의뢰인들로 임명하였다.,"{'word':'보리스 베레조프스키','start_idx':21,'end_idx':30,'type':'EVE'}","{'word':'아흐메드 자카예프','start_idx':33,'end_idx':41,'type':'PER'}",no_relation
303,"러시아 연방( ', ), 약칭 러시아( ', )는 동유럽과 북아시아에 걸쳐 있는 연방제 국가이다.","{'word':'러시아 연방','start_idx':0,'end_idx':5,'type':'ORG'}","{'word':'러시아','start_idx':17,'end_idx':19,'type':'ORG'}",org:alternate_names
304,"이후 2월 26일, 러시아군은 도시의 일부 행정 건물에 러시아 국기를 게양했다.","{'word':'러시아군','start_idx':11,'end_idx':14,'type':'ORG'}","{'word':'러시아','start_idx':31,'end_idx':33,'type':'ORG'}",org:member_of
305,볼로디미르 젤렌스키는 2010년부터 2012년까지 우크라이나의 텔레비전 방송국 인테르의 이사 겸 총 프로듀서로 활동했다.,"{'word':'인테르','start_idx':44,'end_idx':46,'type':'ORG'}","{'word':'볼로디미르 젤렌스키','start_idx':0,'end_idx':9,'type':'PER'}",org:top_members/employees
