,sentence,subject_entity,object_entity,label
0,4월 29일에서 30일 사이엔 우크라이나 헬싱키 그룹이 해체되고 이를 우크라이나 공화당이 새로 창설되어 이어받았다.,"{'word':'공화당','start_idx':45,'end_idx':47,'type':'ORG'}","{'word':'헬싱키 그룹','start_idx':23,'end_idx':28,'type':'ORG'}",no_relation
1,"이 대회 이후 FIFA는 구 소련 공화국의 기록을 독립국으로 각각 독립시켰으며, 소련 팀의 기록은 러시아 축구 국가대표팀 기록으로 승계시켰다.","{'word':'러시아 축구 국가대표팀','start_idx':55,'end_idx':66,'type':'ORG'}","{'word':'FIFA','start_idx':8,'end_idx':11,'type':'ORG'}",org:member_of
2,러시아의 작가 니콜라이 고골의 작품 〈타라스 부리바〉의 배경이 되기로도 알려졌다.,"{'word':'니콜라이 고골','start_idx':8,'end_idx':14,'type':'PER'}","{'word':'작가','start_idx':5,'end_idx':6,'type':'POH'}",per:title
3,8월 1일엔 의회에서 압도적인 찬성으로 체르노빌 원자력 발전소 폐쇄안을 통과시켰다.,"{'word':'체르노빌 원자력 발전소 폐쇄안','start_idx':22,'end_idx':37,'type':'EVE'}","{'word':'8월 1일','start_idx':0,'end_idx':4,'type':'DAT'}",eve:date
4,"약간 다른 관점에서, 데이비드 코츠와 프리드 비어는 소비에트의 엘리트들이 내셔널리즘과 자본주의를 자극시킨 원인이 되었는데, 이들은 각 개인으로는 엄청난 혜택을 보았다고 주장했다.","{'word':'데이비드 코츠','start_idx':12,'end_idx':18,'type':'PER'}","{'word':'프리드 비어','start_idx':21,'end_idx':26,'type':'PER'}",no_relation
5,본부는 프랑스 스트라스부르에 있다.,"{'word':'스트라스부르','start_idx':8,'end_idx':13,'type':'ORG'}","{'word':'프랑스','start_idx':4,'end_idx':6,'type':'ORG'}",org:member_of
6,"12월 26일, 소련 최고 소비에트 상원 격인 연방회의는 소련 및 연방회의 자신에 대한 해체 투표를 열었다. (하원 격인 민족회의는 12월 12일 러시아 대표단이 철수하며 정족수를 못채워 사실상 기능을 중지하였다.) 다음 날 27일부턴 옐친이 고르바초프가 사용했던 전 사무실을 이어받아 직무를 수행하기 시작했다.","{'word':'해체 투표','start_idx':49,'end_idx':53,'type':'EVE'}","{'word':'12월 26일','start_idx':0,'end_idx':6,'type':'DAT'}",eve:date
7,이 무기들은 2월 키예프에 도달했지만 시위 지도자들 및 전문가들에 따르면 우크라이나를 혁명에 이르게 하는 데에는 거의 도움이 되지 않았다고 분석하고 있다.,"{'word':'우크라이나','start_idx':41,'end_idx':45,'type':'ORG'}","{'word':'키예프','start_idx':10,'end_idx':12,'type':'ORG'}",no_relation
8,"예를 들어, 스티븐 워커는 소수민족은 연방 차원에서 힘을 아에 잃어버렸고 문화적으로 불안정한 형태로 경재적 근대화를 맞이했으며 일정 수준으로 러시아화 되었으나 소련의 몇 가지 정책들(토착민족 지도자 승인, 현지어 지원)에 힘입어 의식적인 내셔널리즘을 만들었다고 주장한다.","{'word':'스티븐 워커','start_idx':7,'end_idx':12,'type':'PER'}","{'word':'소련','start_idx':89,'end_idx':90,'type':'ORG'}",no_relation
9,"다른 유엔 회원국에게 이의제기 없이 지나간 후, 1991년 12월 31일에 이 편지가 접수되고 승인되었다.","{'word':'유엔 회원국','start_idx':3,'end_idx':8,'type':'ORG'}","{'word':'1991년 12월 31일','start_idx':27,'end_idx':39,'type':'DAT'}",no_relation
10,"유럽 연합 정상회의(European Council) 또는 유럽 이사회는 유럽 연합 회원국의 국가 원수 또는 정부 장관(각료)과 유럽 연합 정상회의 상임의장, 유럽 연합 집행위원회 위원장으로 구성되고 마스트리흐트 조약(Maastricht Treaty)에 규정이 있는 기관이다.","{'word':'유럽 연합 정상회의','start_idx':0,'end_idx':9,'type':'ORG'}","{'word':'유럽 이사회','start_idx':32,'end_idx':37,'type':'ORG'}",org:alternate_names
11,7월 11일엔 이바시코가 소련 공산당 부서기로 선출된 후 우크라이나 의회 의장 자리에 사임하였다.,"{'word':'이바시코','start_idx':8,'end_idx':11,'type':'PER'}","{'word':'부서기','start_idx':21,'end_idx':23,'type':'POH'}",per:title
12,이에 형식상으로는 소련에서 가장 큰 공화국이 탈퇴한 것으로 보였으나 러시아 측에서는 '더 이상 존재하지 않는 나라'에서 탈퇴하는 것은 불가능하므로 이 같은 말은 사실이 아니라고 말했다.,"{'word':'러시아','start_idx':38,'end_idx':40,'type':'ORG'}","{'word':'소련','start_idx':10,'end_idx':11,'type':'ORG'}",org:member_of
13,"같은 날 러시아 SFSR 최고 소비에트는 러시아의 법적 국명을 ""러시아 소비에트 사회주의 연방 공화국""에서 ""러시아 연방""으로 바꾸어 주권국임을 보여주는 법령을 통과시켰다.","{'word':'러시아 SFSR 최고 소비에트','start_idx':5,'end_idx':20,'type':'ORG'}","{'word':'러시아','start_idx':23,'end_idx':25,'type':'ORG'}",org:member_of
14,"시위대는 급진적인 경제, 정치개혁을 요구하며 정부청사에 방화하고 상점은 약탈당했다.","{'word':'시위대','start_idx':0,'end_idx':2,'type':'ORG'}","{'word':'정부청사','start_idx':25,'end_idx':28,'type':'LOC'}",no_relation
15,"2월 26일, 이고르 콜리카예프 시장에 따르면, 러시아군은 러시아의 장갑차에 대한 우크라이나군의 공습 이후, 헤르손에서 철수했다.","{'word':'이고르 콜리카예프','start_idx':8,'end_idx':16,'type':'PER'}","{'word':'시장','start_idx':18,'end_idx':19,'type':'POH'}",per:title
16,"2022년 2월 25일, 이반키우 전투에서 우크라이나의 방어를 돌파한 러시아 지상군이 공항을 다시 점령했다.","{'word':'우크라이나','start_idx':24,'end_idx':28,'type':'ORG'}","{'word':'러시아','start_idx':39,'end_idx':41,'type':'ORG'}",org:hostile
17,2014년 1월 23일부터는 유로마이단의 서부 우크라이나 주 정부청사 및 지역의회에 대한 점령 운동이 시작되었다.,"{'word':'정부청사','start_idx':34,'end_idx':37,'type':'ORG'}","{'word':'서부 우크라이나','start_idx':23,'end_idx':30,'type':'ORG'}",org:member_of
18,거의 남쪽 만으로 강이 빠져나가고 남동부 지방에는 다뉴브 삼각지가 루마니아와 국경을 접하고 있다.,"{'word':'루마니아','start_idx':37,'end_idx':40,'type':'ORG'}","{'word':'다뉴브 삼각지','start_idx':28,'end_idx':34,'type':'LOC'}",no_relation
19,이러한 일련의 분리주의 세력이 커지면서 고르바초프는 소련을 덜 중앙집중적인 국가로 만들고자 했다.,"{'word':'소련','start_idx':29,'end_idx':30,'type':'ORG'}","{'word':'고르바초프','start_idx':22,'end_idx':26,'type':'PER'}",no_relation
20,따라서 유럽 연합 이사회의 정식 명칭도 공용어와 같은 수만큼 있다.,"{'word':'이사회','start_idx':10,'end_idx':12,'type':'ORG'}","{'word':'유럽 연합','start_idx':4,'end_idx':8,'type':'ORG'}",org:member_of
21,소련이 사용했던 국가번호인 +7는 러시아와 카자흐스탄이 승계받아 계속 사용하고 있다.,"{'word':'카자흐스탄','start_idx':24,'end_idx':28,'type':'ORG'}","{'word':'러시아','start_idx':19,'end_idx':21,'type':'ORG'}",no_relation
22,하지만 1945년 10월 24일에 벨로루시 소비에트 사회주의 공화국과 우크라이나 소비에트 사회주의 공화국은 소련과 동시에 유엔에 가입하였다.,"{'word':'벨로루시 소비에트 사회주의 공화국','start_idx':19,'end_idx':36,'type':'ORG'}","{'word':'유엔','start_idx':68,'end_idx':69,'type':'ORG'}",org:member_of
23,"2월 28일, 우크라이나 고문 안톤 헤라쉬첸코는 러시아의 로켓 공격으로 민간인 수십 명이 사망했다고 밝혔다.","{'word':'안톤 헤라쉬첸코','start_idx':17,'end_idx':24,'type':'PER'}","{'word':'고문','start_idx':14,'end_idx':15,'type':'POH'}",per:title
24,"이로 인해 러시아군은 드네프르강을 도하해 북쪽으로 가장 가까운 노바카호우카로 진격하여, 점령했다.","{'word':'러시아군','start_idx':6,'end_idx':9,'type':'ORG'}","{'word':'노바카호우카','start_idx':35,'end_idx':40,'type':'ORG'}",org:hostile
25,"소련법에선 공화국이 대표단을 일방적으로 송환하는 것을 허용하지 않았기 때문에 이 행동에 대한 적법성엔 논란이 있었다. 하지만 이에 대해 러시아 측, 크레믈린 측 어느 쪽도 반대하진 않았다.","{'word':'크레믈린','start_idx':83,'end_idx':86,'type':'ORG'}","{'word':'러시아','start_idx':76,'end_idx':78,'type':'ORG'}",no_relation
26,그러나 미·소 양국은 약자인 이들 비핵보유국에게 조약을 강요한면이 없지 않다.,"{'word':'비핵보유국','start_idx':19,'end_idx':23,'type':'ORG'}","{'word':'미·소','start_idx':4,'end_idx':6,'type':'ORG'}",no_relation
27,3일 후인 8월 21일 쿠데타는 실패하였다.,"{'word':'쿠데타','start_idx':13,'end_idx':15,'type':'EVE'}","{'word':'8월 21일','start_idx':6,'end_idx':11,'type':'DAT'}",no_relation
28,"헤르손 전투(, )는 2022년 2월 24일 러시아의 우크라이나 침공 당시 벌어진 전투이다.","{'word':'헤르손 전투','start_idx':0,'end_idx':5,'type':'EVE'}","{'word':'2022년 2월 24일','start_idx':12,'end_idx':23,'type':'DAT'}",eve:date
29,6월 4일엔 국회의장 선거에 후보 2명이 출마했다.,"{'word':'국회의장 선거','start_idx':7,'end_idx':13,'type':'EVE'}","{'word':'6월 4일','start_idx':0,'end_idx':4,'type':'DAT'}",no_relation
30,이 전투는 매우 격렬했으며 사망한 병사들과 파괴된 군용 차량 몇 대가 다리에 놓여있는 것으로 설명됐다.,"{'word':'병사','start_idx':19,'end_idx':20,'type':'PER'}","{'word':'군용 차량','start_idx':28,'end_idx':32,'type':'ORG'}",no_relation
31,독립 이후 우크라이나 소비에트 사회주의 공화국은 1991년 8월 24일 국명을 우크라이나로 바꿨다고 통보했으며 벨라루스 소비에트 사회주의 공화국은 1991년 9월 19일 벨라루스 공화국으로 바꿨다고 유엔에 통보했다.,"{'word':'벨라루스 공화국','start_idx':95,'end_idx':102,'type':'ORG'}","{'word':'우크라이나','start_idx':44,'end_idx':48,'type':'ORG'}",no_relation
32,"그리고 동방 정교회는 8%를 구성하고, 다른 기독교인들은 유럽 연합 인구의 4%를 차지한다.","{'word':'동방 정교회','start_idx':4,'end_idx':9,'type':'ORG'}","{'word':'유럽 연합','start_idx':32,'end_idx':36,'type':'ORG'}",no_relation
33,"옐친은 선거 운동에서 소련의 ""중앙정부 독재""를 비판했으나 민영화 도입에 대해서는 말하지 않았다.","{'word':'옐친','start_idx':0,'end_idx':1,'type':'PER'}","{'word':'소련','start_idx':12,'end_idx':13,'type':'ORG'}",no_relation
34,우크라이나의 대표적인 산은 카르파티아 산맥으로서 우크라이나 서부에 위치한다.,"{'word':'우크라이나','start_idx':0,'end_idx':4,'type':'ORG'}","{'word':'카르파티아 산맥','start_idx':15,'end_idx':22,'type':'LOC'}",no_relation
35,9월 5일에서 7일 사이엔 키예프에서 1932-1933년 우크라이나 대기근에 대한 국제 심포지엄이 열렸다.,"{'word':'국제 심포지엄','start_idx':46,'end_idx':52,'type':'EVE'}","{'word':'키예프','start_idx':15,'end_idx':17,'type':'LOC'}",eve:place
36,에스토니아가 탈린 시간으로 1991년 8월 20일 오후 11시 3분에 8월 쿠데타가 진행되는 도중 독립을 선포하고 많은 에스토니아인들이 탈린 텔레비전탑으로 몰려가 소련군이 포위점령하기 전에 먼저 장악하여 소련군간의 통신을 끊으러 시도했다.,"{'word':'8월 쿠데타','start_idx':39,'end_idx':44,'type':'EVE'}","{'word':'1991년 8월 20일','start_idx':15,'end_idx':26,'type':'DAT'}",eve:date
37,"2월 27일 오후, 시니예후보프는 우크라이나군이 도시를 완전히 장악했다고 발표했다.","{'word':'시니예후보프','start_idx':11,'end_idx':16,'type':'PER'}","{'word':'우크라이나군','start_idx':19,'end_idx':24,'type':'ORG'}",no_relation
38,"우익 섹터는 2014년 3월 22일에 정당으로 되었고, 당시에 1만 명의 당원을 가지고 있는 걸로 추산되었다.","{'word':'우익 섹터','start_idx':0,'end_idx':4,'type':'ORG'}","{'word':'2014년 3월 22일','start_idx':7,'end_idx':18,'type':'DAT'}",no_relation
39,"1957년 창립 회원국은 네덜란드, 서독(현재의 독일), 룩셈부르크, 벨기에, 이탈리아, 프랑스 총 여섯 국가이다.","{'word':'룩셈부르크','start_idx':32,'end_idx':36,'type':'ORG'}","{'word':'이탈리아','start_idx':44,'end_idx':47,'type':'ORG'}",no_relation
40,야로시는 우익 섹터가 우크라이나 디아스포라에서 일부 자금 지원을 받았다고 말했다.,"{'word':'우크라이나 디아스포라','start_idx':12,'end_idx':22,'type':'ORG'}","{'word':'우익 섹터','start_idx':5,'end_idx':9,'type':'ORG'}",org:friendly
41,"1993년부터 1997년 사이엔 기타 공화국들이 +375(벨라루스), +380(우크라이나)같은 새로운 국가번호를 부여받았다.","{'word':'우크라이나','start_idx':44,'end_idx':48,'type':'ORG'}","{'word':'벨라루스','start_idx':32,'end_idx':35,'type':'ORG'}",no_relation
42,1990년 3월엔 최고 소비에트 의장에 뮈탈리보프가 올라갔다.,"{'word':'소비에트','start_idx':13,'end_idx':16,'type':'PER'}","{'word':'1990년 3월','start_idx':0,'end_idx':7,'type':'DAT'}",no_relation
43,신문 우크라인스카 프라우다는 세바스토폴의 우크라이나 해군 빌딩은 러시아군의 포위 공격을 받고 있다고 전했다.,"{'word':'세바스토폴','start_idx':16,'end_idx':20,'type':'ORG'}","{'word':'해군 빌딩','start_idx':29,'end_idx':33,'type':'ORG'}",org:property
44,2013년 8월 중순 러시아는 8월 14일 연방세관부가 우크라이나의 모든 상품 수입 금지와 같은 우크라이나에 대한 수입 관세 법률을 바꿨다.,"{'word':'러시아','start_idx':12,'end_idx':14,'type':'ORG'}","{'word':'우크라이나','start_idx':31,'end_idx':35,'type':'ORG'}",no_relation
45,7월 31일 밤에는 발트해의 소련 군사 본부가 있는 리가에서 OMON 특수부대 요원이 메디닝카이에 있는 리투아니아의 국경 초소를 공격하여 리투아니아 경찰 6명이 사망했다.,"{'word':'리투아니아','start_idx':58,'end_idx':62,'type':'ORG'}","{'word':'국경 초소','start_idx':65,'end_idx':69,'type':'ORG'}",org:property
46,쿠데타 주동자들은 옐친을 체포하러 했으나 실패하였고 옐친은 전차 위에 올라타 쿠데타에 반대하는 연설을 하였다.,"{'word':'쿠데타 주동자들','start_idx':0,'end_idx':7,'type':'PER'}","{'word':'옐친','start_idx':29,'end_idx':30,'type':'PER'}",no_relation
47,"미국과 소련 그리고 비핵보유국가의 논쟁은 1968년 6월 19일 미, 영, 소 3국이 '적극적 안전보장'을 유엔안보리에 제출, 발표함으로써 NPT의 구성이 완료가 되었다","{'word':'미국','start_idx':0,'end_idx':1,'type':'ORG'}","{'word':'소련','start_idx':4,'end_idx':5,'type':'ORG'}",no_relation
48,9월 30일엔 키예프에서 10만명이 모여 고르바초프의 신연방 조약에 반대하는 시위가 열렸다.,"{'word':'고르바초프','start_idx':23,'end_idx':27,'type':'PER'}","{'word':'키예프','start_idx':8,'end_idx':10,'type':'ORG'}",no_relation
49,EU의 주요 회원국은 우크라이나와의 협력 강화 합의안에 서명하였고 미국은 여행 금지 제재 대상에 러시아인 20명과 푸틴 대통령의 돈줄로 알려진 은행 1곳을 추가했다.,"{'word':'푸틴','start_idx':64,'end_idx':65,'type':'PER'}","{'word':'대통령','start_idx':67,'end_idx':69,'type':'POH'}",per:title
50,또한 쿠데타 세력들은 외국 방송에 대한 전파방해를 하지 않아 많은 모스크바 시민들은 CNN 방송을 통해 소식을 들었다.,"{'word':'모스크바','start_idx':37,'end_idx':40,'type':'ORG'}","{'word':'CNN 방송','start_idx':47,'end_idx':52,'type':'POH'}",no_relation
51,2013년 11월 25일 우크라이나 정부가 EU와 진행 중인 일련의 협상건을 전면 중단하면서 수도 키예프에서 시민들의 자발적인 시위가 촉발되었다.,"{'word':'EU','start_idx':24,'end_idx':25,'type':'ORG'}","{'word':'키예프','start_idx':55,'end_idx':57,'type':'ORG'}",no_relation
52,"시위대들은 2013년 11월 30일 대규모 공격을 시작하면서 ""우크라이나의 운명을 바꾸기 위해"" 참여한다고 언급했다.","{'word':'시위대','start_idx':0,'end_idx':2,'type':'ORG'}","{'word':'우크라이나','start_idx':35,'end_idx':39,'type':'ORG'}",no_relation
53,이어 G7 국가는 공동 설명을 내어 러시아의 조치를 비판했으며 6월 소치에서 열릴 G8 정상회의에 대한 준비에도 불참하겠다고 밝혔다.,"{'word':'G7 국가','start_idx':3,'end_idx':7,'type':'ORG'}","{'word':'러시아','start_idx':20,'end_idx':22,'type':'ORG'}",no_relation
54,"2022년 2월 24일 러시아군의 전차 및 부대가 수미로 이동하기 시작했고, 현지 시각 새벽 3시부터 외각에서의 전투가 시작되었다.","{'word':'러시아군','start_idx':13,'end_idx':16,'type':'ORG'}","{'word':'2022년 2월 24일','start_idx':0,'end_idx':11,'type':'DAT'}",no_relation
55,"리투아니아에서 유혈 충돌이 일어난 후, 라트비아군은 즉시 리가에서 주요 도로와 다리 곳곳을 바리케이드로 막아 방어하는 등 방어 조직을 설치하는 바리케이드 사건이 일어났다. 하지만 1월 20일 소련군이 라트비아 내무부 건물을 공격하여 유혈로 장악, 민간인 4명이 사망하고 수십명이 부상을 입었다.","{'word':'소련군','start_idx':107,'end_idx':109,'type':'ORG'}","{'word':'라트비아군','start_idx':22,'end_idx':26,'type':'ORG'}",org:hostile
56,우크라이나군은 또한 러시아 연료 트럭 호송대를 괴멸시켰다고 주장했다.,"{'word':'우크라이나군','start_idx':0,'end_idx':5,'type':'ORG'}","{'word':'러시아','start_idx':11,'end_idx':13,'type':'ORG'}",org:hostile
57,"아침 늦게 러시아군이 하르키우에 진입했고 올레흐 시니예후보프는 도시 내에서 격렬한 전투가 벌어지고 있다고 말했으며, 내무부 고문인 안톤 게라셴코는 도시 중심부에서 시가전이 진행 중이라고 주장했다.","{'word':'내무부','start_idx':65,'end_idx':67,'type':'ORG'}","{'word':'안톤 게라셴코','start_idx':73,'end_idx':79,'type':'PER'}",org:top_members/employees
58,바쿠 시민 거의 대부분이 순교자의 골목에 묻힌 '순교자'들의 집단장례식에 참여하였다.,"{'word':'집단장례식','start_idx':34,'end_idx':38,'type':'EVE'}","{'word':'순교자','start_idx':27,'end_idx':29,'type':'PER'}",no_relation
59,며칠 이후에는 대학생 거의 대부분이 시위 대열에 합류했다.,"{'word':'시위 대열','start_idx':20,'end_idx':24,'type':'ORG'}","{'word':'대학생','start_idx':8,'end_idx':10,'type':'PER'}",no_relation
60,"7월 16일 올라온 우크라이나 주권 선언 안건에서 찬성 355표, 반대 4표의 압도적 찬성율로 통과되었다.","{'word':'우크라이나 주권 선언 안건','start_idx':11,'end_idx':24,'type':'EVE'}","{'word':'7월 16일','start_idx':0,'end_idx':5,'type':'DAT'}",eve:date
61,"만약 소련 연방정부가 반대했다 쳐도, 12월도 채 되지 않아 영향력을 완전히 상실했기 때문에 반대가 어떤 의미도 없었을 것이었다.","{'word':'연방정부','start_idx':6,'end_idx':9,'type':'ORG'}","{'word':'소련','start_idx':3,'end_idx':4,'type':'ORG'}",org:member_of
62,일본의 대러시아 제재는 미국 및 유럽 등 서방국가에 비해 늦고 그 규모가 정확히 명시되어 있지 않았는데 이는 일본이 쿠릴열도 협상을 진행 중인데다 러시아로부터 에너지 수입량을 크게 늘린 상태이기 때문으로 풀이된다.,"{'word':'일본','start_idx':0,'end_idx':1,'type':'ORG'}","{'word':'러시아','start_idx':82,'end_idx':84,'type':'ORG'}",no_relation
63,이후 이 봉기는 전국적인 봉기로 확대되었으며 세계 각국은 우크라이나 정부의 폭력 진압을 규탄했다.,"{'word':'세계 각국','start_idx':25,'end_idx':29,'type':'ORG'}","{'word':'우크라이나 정부','start_idx':32,'end_idx':39,'type':'ORG'}",no_relation
64,유럽 연합은 회원국 전체에 적용되는 표준화된 법을 통해 유럽 단일 시장을 발전시키고 있다.,"{'word':'유럽 연합','start_idx':0,'end_idx':4,'type':'ORG'}","{'word':'유럽','start_idx':31,'end_idx':32,'type':'ORG'}",no_relation
65,8월 24일엔 고르바초프가 소련 공산당 중앙위원회를 해산시키고 당서기 직에 사임했으며 연방정부 내 모든 공산당 조직을 해체시켰다.,"{'word':'고르바초프','start_idx':8,'end_idx':12,'type':'PER'}","{'word':'소련 공산당 중앙위원회','start_idx':15,'end_idx':26,'type':'ORG'}",no_relation
66,2010년 6월 현재 가맹국은 미국·러시아·중국·영국·프랑스 등 핵보유국을 비롯한 189개국이다.,"{'word':'중국','start_idx':24,'end_idx':25,'type':'ORG'}","{'word':'가맹국','start_idx':12,'end_idx':14,'type':'ORG'}",org:member_of
67,게다가 조약의 비당사국들은 오히려 NPT의 틈새를 이용하여 핵국가와 비핵국가 사이에서 이익을 추구해왔으며 핵개발에 앞장서 왔다.,"{'word':'비당사국','start_idx':8,'end_idx':11,'type':'ORG'}","{'word':'핵국가','start_idx':33,'end_idx':35,'type':'ORG'}",no_relation
68,이튿날 유럽 의회는 크림 공화국의 독립에 관련된 개정을 불인정하겠다고 천명했으며 국제법과 우크라이나 헌법에 불합치한다고 선을 그었다.,"{'word':'우크라이나','start_idx':50,'end_idx':54,'type':'ORG'}","{'word':'크림 공화국','start_idx':11,'end_idx':16,'type':'ORG'}",no_relation
69,"이 안은 소련 내 공동경제로 큰 경제적 혜택을 보고 있던 중앙아시아 공화국들이 강력하게 지지했다. 하지만 이는 경제적, 사회적으로 어느 정도 공산당이 계속 지배하고 있음을 뜻하는 것이었다.","{'word':'소련','start_idx':5,'end_idx':6,'type':'ORG'}","{'word':'중앙아시아 공화국','start_idx':32,'end_idx':40,'type':'ORG'}",no_relation
70,루스 카간국으로부터 키예프 대공국으로 이어진 우크라이나는 튀르크족·몽골족 등의 오랜 지배를 받았다.,"{'word':'루스 카간국','start_idx':0,'end_idx':5,'type':'ORG'}","{'word':'키예프 대공국','start_idx':11,'end_idx':17,'type':'ORG'}",no_relation
71,2022년 2월 25일에 우크라이나 군대는 아이다르강을 건너기 위해 준비중인 러시아군 종대를 궤멸하였다고 주장하고 있다.,"{'word':'우크라이나 군대','start_idx':14,'end_idx':21,'type':'ORG'}","{'word':'러시아군 종대','start_idx':43,'end_idx':49,'type':'ORG'}",org:hostile
72,"9월 8일엔 리비우에서 1933년 이후 처음으로 ""그리스도 청년단"" 행진 집회가 열렸다.","{'word':'행진 집회','start_idx':38,'end_idx':42,'type':'EVE'}","{'word':'리비우','start_idx':7,'end_idx':9,'type':'LOC'}",eve:place
73,"2014년 1월 25일부터 시위대들은 광범위한 인권 억압, 권력 남용, 정부 부패 인식 등에도 항의하기 시작했다.","{'word':'시위대','start_idx':15,'end_idx':17,'type':'ORG'}","{'word':'정부','start_idx':40,'end_idx':41,'type':'ORG'}",no_relation
74,러시아 정교회 측은 이 안건을 비토하였다.,"{'word':'정교회','start_idx':4,'end_idx':6,'type':'ORG'}","{'word':'러시아','start_idx':0,'end_idx':2,'type':'ORG'}",org:member_of
75,"2012년 3월 30일, EU와 우크라이나 간 위원회 계약 체결이 시작되었다.","{'word':'위원회 계약 체결','start_idx':26,'end_idx':34,'type':'EVE'}","{'word':'2012년 3월 30일','start_idx':0,'end_idx':11,'type':'DAT'}",eve:date
76,러시아군은 러시아-우크라이나 국경 근처에 위치한 우크라이나 수미를 점령했다.,"{'word':'러시아','start_idx':6,'end_idx':8,'type':'ORG'}","{'word':'우크라이나','start_idx':10,'end_idx':14,'type':'ORG'}",org:hostile
77,"남쪽과 남동쪽으로는 흑해와 아조프 해, 동쪽과 북동쪽으로는 러시아, 북쪽과 북서쪽으로는 벨라루스, 서쪽으로는 폴란드, 슬로바키아, 헝가리, 남서쪽으로는 루마니아, 몰도바와 접한다.","{'word':'폴란드','start_idx':61,'end_idx':63,'type':'ORG'}","{'word':'슬로바키아','start_idx':66,'end_idx':70,'type':'ORG'}",no_relation
78,1991년 말까지 러시아가 인수인계하지 않은 소련 연방 기관은 운영을 중지했고 개별 공화국은 중앙정부로 승격되어 통치를 시작했다.,"{'word':'소련 연방 기관','start_idx':25,'end_idx':32,'type':'ORG'}","{'word':'러시아','start_idx':10,'end_idx':12,'type':'ORG'}",no_relation
79,"3월 1일 미국의 버락 오바마 대통령은 ""러시아의 군사 행동에는 대가가 따를 것""이라며 이를 규탄하는 성명을 발표하였다.","{'word':'버락 오바마','start_idx':10,'end_idx':15,'type':'PER'}","{'word':'대통령','start_idx':17,'end_idx':19,'type':'POH'}",per:title
80,우크라이나와 EU 간의 불화가 지속되고 있는 가운데 유로마이단은 EU 자체에 있어서 상징적인 의미를 갖는다.,"{'word':'우크라이나','start_idx':0,'end_idx':4,'type':'ORG'}","{'word':'EU','start_idx':7,'end_idx':8,'type':'ORG'}",no_relation
