,sentence,subject_entity,object_entity,label
311,"2월 27일 아침, 러시아 차량 행렬이 동쪽에서 수미로 진군했다.","{'word':'러시아','start_idx':11,'end_idx':13,'type':'ORG'}","{'word':'2월 27일','start_idx':0,'end_idx':5,'type':'DAT'}",no_relation
312,"법적 공용어는 우크라이나어이지만 실질적으로는 많은 사람들이 러시아어를 일상적으로 사용하며 인구의 절반(주로 동부 지역과 동남부 지역, 오데사 지역)이 러시아어 사용자이며 일반적으로 학교/회사나 인터넷 사이트에서는 두 언어 모두 사용하고 있으며 사실상 러시아어가 제2의 공용어 지위를 유지하고 있다.","{'word':'우크라이나','start_idx':8,'end_idx':12,'type':'ORG'}","{'word':'러시아','start_idx':33,'end_idx':35,'type':'ORG'}",no_relation
313,"우크라이나의 경지율은 약 70%에 이르고 있어, 겨울밀·옥수수·보리·사탕무·해바라기·포도의 재배, 가축사양 등에서는 구 소련 시절 매우 중요한 지위를 차지하고 있었다.","{'word':'소련','start_idx':67,'end_idx':68,'type':'ORG'}","{'word':'우크라이나','start_idx':0,'end_idx':4,'type':'ORG'}",no_relation
314,러시아 낙하산 부대로 구성된 첫 번째 공격은 2월 24일 공수강하하여 잠시 공항을 점령한 후 격퇴되었다.,"{'word':'러시아 낙하산 부대','start_idx':0,'end_idx':9,'type':'ORG'}","{'word':'공항','start_idx':42,'end_idx':43,'type':'ORG'}",no_relation
315,8월 3일엔 우크라이나 경제주권법을 통과시켰다.,"{'word':'우크라이나 경제주권법','start_idx':7,'end_idx':17,'type':'EVE'}","{'word':'8월 3일','start_idx':0,'end_idx':4,'type':'DAT'}",no_relation
316,2013년 12월 세 개의 투표 결과를 종합하면 45%에서 50%의 시민이 유로마이단 시위를 지지했으며 42~50% 정도가 반대한다고 밝혀졌다.,"{'word':'유로마이단 시위','start_idx':42,'end_idx':49,'type':'EVE'}","{'word':'2013년 12월','start_idx':0,'end_idx':8,'type':'DAT'}",no_relation
317,같은 날 우크라이나 의회 의장인 크라우추크와 러시아 의회 의장인 옐친이 만나 10년간의 양자 협정을 맺었다.,"{'word':'크라우추크','start_idx':18,'end_idx':22,'type':'PER'}","{'word':'옐친','start_idx':36,'end_idx':37,'type':'PER'}",no_relation
318,"결국 수 차례 협상 결과 1992년 1월 11일 흑해함대를 분할, 일부를 러시아 관할로, 일부를 우크라이나 관할로 두기로 합의했다. 하지만 이후에도 군 분할에 대해 러시아와 우크라이나 간 입장차로 충돌하다 1992년 8월 정상회담을 열어 1995년까지 3년간 과도기로 러시아-우크라이나 통합군 형태로 공동 관할하기로 하였다.","{'word':'정상회담','start_idx':124,'end_idx':127,'type':'EVE'}","{'word':'1992년 8월','start_idx':115,'end_idx':122,'type':'DAT'}",eve:date
319,"이사회 회의에는 EU 외교·안보 정책 대표도 참석하며, 상임의장이 의사 진행을 한다.","{'word':'EU','start_idx':9,'end_idx':10,'type':'ORG'}","{'word':'상임의장','start_idx':31,'end_idx':34,'type':'PER'}",org:top_members/employees
320,이후 한달 동안 시민들은 우크라이나의 대통령 빅토르 야누코비치가 우크라이나 의회에서 우크라이나가 EU 기준을 만족시킬 수 있는 법을 제정하라는 시위를 했다.,"{'word':'빅토르 야누코비치','start_idx':25,'end_idx':33,'type':'PER'}","{'word':'대통령','start_idx':21,'end_idx':23,'type':'POH'}",per:title
321,"고르바초프는 이를 또 다른 쿠데타라고 하며 비판하였다. 하지만 조약 전문에 나와 있는, ""소련은 국제법 및 지정학적 현실 등으로 인해 더 이상 존재하지 않는다.""에 대해선 사실상 의문의 여지가 없었다.","{'word':'고르바초프','start_idx':0,'end_idx':4,'type':'PER'}","{'word':'소련','start_idx':50,'end_idx':51,'type':'ORG'}",no_relation
322,"1991년 1월 13일, 소련군과 KGB 스페츠나츠 알파 그룹은 리투아니아 독립운동을 진압하기 위해 빌뉴스의 TV 방송타워를 습격하였다.","{'word':'리투아니아 독립운동','start_idx':36,'end_idx':45,'type':'EVE'}","{'word':'1991년 1월 13일','start_idx':0,'end_idx':11,'type':'DAT'}",no_relation
323,각 당사국은 동 탈퇴 통고를 3개월 전에 모든 조약 당사국과 유엔 안전보장이사회에 행한다.,"{'word':'유엔 안전보장이사회','start_idx':34,'end_idx':43,'type':'ORG'}","{'word':'당사국','start_idx':2,'end_idx':4,'type':'ORG'}",no_relation
324,"같은 날, 우크라이나는 러시아 제74차량화소총여단의 정찰 소대가 항복했다고 주장했다.","{'word':'러시아','start_idx':13,'end_idx':15,'type':'ORG'}","{'word':'제74차량화소총여단','start_idx':17,'end_idx':26,'type':'ORG'}",org:property
325,"7월 30일엔 의회가 ""아르메니아나 아제르바이잔 같은 분쟁 지역에 있는 우크라이나 병사들""에게 우크라이나로 귀환하라는 요구를 담은 결의안을 통과시켰다.","{'word':'아제르바이잔','start_idx':20,'end_idx':25,'type':'ORG'}","{'word':'아르메니아','start_idx':13,'end_idx':17,'type':'ORG'}",no_relation
326,하지만 반체제 인사들은 소련이 점점 여러 독립국으로 분열되고 있다고 해도 시장경제로 급속히 체제를 바꿔야 한다고 주장했다.,"{'word':'소련','start_idx':13,'end_idx':14,'type':'ORG'}","{'word':'반체제 인사들','start_idx':4,'end_idx':10,'type':'PER'}",org:top_members/employees
327,우익 섹터는 2014년 우크라이나 혁명이 거의 끝나갈 무렵 우크라이나 서부에 위치한 리비우주의 리비우 근처의 내무부 무기고에서 군사 무기들을 압수했다.,"{'word':'리비우주','start_idx':47,'end_idx':50,'type':'ORG'}","{'word':'우크라이나 서부','start_idx':33,'end_idx':40,'type':'ORG'}",org:member_of
328,"10월 25일에서 28일 사이엔 루흐 전선이 두번째 총회를 개최하고 이 자리에서 전선의 주요 목적이 ""우크라이나의 독립국가 건국""임을 선포하였다.","{'word':'두번째 총회','start_idx':25,'end_idx':30,'type':'EVE'}","{'word':'10월 25일','start_idx':0,'end_idx':6,'type':'DAT'}",eve:date
329,"우크라이나 경찰이 시위 견제를 유지하는 가운데 시위가 진행 중에 있으며, 눈발이 날리는 영하 날씨인 가운데 11월 30일 아침 일찍 정부 병력이 폭력적으로 진압하면서 40만~80만 명으로 시위 참여자가 급증하게 됐다.","{'word':'우크라이나','start_idx':0,'end_idx':4,'type':'ORG'}","{'word':'경찰','start_idx':6,'end_idx':7,'type':'ORG'}",org:property
330,"옐친이 러시아 공화국 대통령에 당선된 이후, 러시아는 즉시 독립을 선포하였다.","{'word':'러시아 공화국','start_idx':4,'end_idx':10,'type':'ORG'}","{'word':'옐친','start_idx':0,'end_idx':1,'type':'PER'}",org:top_members/employees
331,"유럽 연합은 세계 곳곳에 정치 사절단을 파견했으며, 유엔, 세계 무역 기구, G7, G20 등에 대표단을 보내기도 한다.","{'word':'세계 무역 기구','start_idx':33,'end_idx':40,'type':'ORG'}","{'word':'G20','start_idx':47,'end_idx':49,'type':'ORG'}",no_relation
332,유럽 연합(EU)은 유럽 연합 회원국 내에서 사용되는 많은 언어와 방언 중에서 24개의 언어를 공식 언어 및 실무 언어로 정하고 있다.,"{'word':'유럽 연합','start_idx':0,'end_idx':4,'type':'ORG'}","{'word':'EU','start_idx':6,'end_idx':7,'type':'ORG'}",org:alternate_names
333,군사력 운영의 질적 수준은 아직 러시아와 벨라루스의 중간이다.,"{'word':'러시아','start_idx':18,'end_idx':20,'type':'ORG'}","{'word':'벨라루스','start_idx':23,'end_idx':26,'type':'ORG'}",no_relation
334,경찰 및 정부의 폭력적 진압에 항의하여 12월 1일과 2014년 1월 19일~25일 동안 폭력 집회가 일어났다.,"{'word':'경찰','start_idx':0,'end_idx':1,'type':'ORG'}","{'word':'정부','start_idx':5,'end_idx':6,'type':'ORG'}",no_relation
335,최종적으로 1997년 5월 28일 러시아와 우크라이나 사이 정상회담이 열려 3개 조항 합의를 맺어 흑해함대 분할 및 모항 관할에 대한 분쟁을 끝냈다.,"{'word':'정상회담','start_idx':33,'end_idx':36,'type':'EVE'}","{'word':'1997년 5월 28일','start_idx':6,'end_idx':17,'type':'DAT'}",eve:date
336,"러시아는 흑해함대의 공동관할, 우크라이나는 단일관할을 주장하였다.","{'word':'우크라이나','start_idx':17,'end_idx':21,'type':'ORG'}","{'word':'러시아','start_idx':0,'end_idx':2,'type':'ORG'}",no_relation
337,"그보다 7일 전인 12월 17일엔 고르바초프와 옐친이 만나 소비에트 연방의 해체는 ""기정사실""임을 합의했다.","{'word':'소비에트 연방','start_idx':33,'end_idx':39,'type':'ORG'}","{'word':'12월 17일','start_idx':10,'end_idx':16,'type':'DAT'}",no_relation
338,"친EU에 관련된 시위로는 역사상 최대 규모의 시위가 회원국 내에서 벌어지고 있기 때문이며, 손상된 EU 내부의 자신감을 높일 수 있을 것으로 보이기 때문이다.","{'word':'EU','start_idx':55,'end_idx':56,'type':'ORG'}","{'word':'회원국','start_idx':29,'end_idx':31,'type':'ORG'}",no_relation
339,쿠데타 주동자들은 전원 체포되었으며 고르바초프는 대통령직에 복귀하였으나 사실상 모든 권력을 잃었다.,"{'word':'고르바초프','start_idx':20,'end_idx':24,'type':'PER'}","{'word':'쿠데타 주동자들','start_idx':0,'end_idx':7,'type':'PER'}",no_relation
340,이 정당은 2013년 11월 유로마이단 시위 당시 키예프에서 우크라이나 국민 의회 - 우크라이나 인민 자위(UNA-UNSO) 및 극우 민족주의 단체와 연합하면서 처음 나타났다.,"{'word':'유로마이단 시위','start_idx':16,'end_idx':23,'type':'EVE'}","{'word':'2013년 11월','start_idx':6,'end_idx':14,'type':'DAT'}",eve:date
341,"그는 뉴스위크에서 군, 국가안보위원회, 방위위원회 등의 단체와 함께 ""어떤 군대와도 같이"" S-300 미사일 조종을 훈련받은 전문가 다수가 있다고 말했다.","{'word':'국가안보위원회','start_idx':13,'end_idx':19,'type':'ORG'}","{'word':'방위위원회','start_idx':22,'end_idx':26,'type':'ORG'}",no_relation
342,"2월 24일, 러시아군은 국경을 넘어 하르키우까지 진격하기 시작했다.","{'word':'러시아군','start_idx':8,'end_idx':11,'type':'ORG'}","{'word':'하르키우','start_idx':21,'end_idx':24,'type':'ORG'}",org:hostile
343,또한 3월엔 필라레트를 위시한 우크라이나 정교회가 자치권을 얻은 데 이어 6월엔 우크라이나 독립정교회가 러시아 정교회 모스크바 총대주교청으로부터 완전히 독립하였다.,"{'word':'독립정교회','start_idx':51,'end_idx':55,'type':'ORG'}","{'word':'총대주교청','start_idx':71,'end_idx':75,'type':'ORG'}",no_relation
344,"우크라이나는 비옥한 평원, 스텝, 고원이 있으며, 그들을 지나가는 강이 흑해로 흘러들어간다.","{'word':'우크라이나','start_idx':0,'end_idx':4,'type':'ORG'}","{'word':'흑해','start_idx':40,'end_idx':41,'type':'LOC'}",no_relation
345,9월 말이 되면 고르바초프는 모스크바 외엔 영향력이 닿질 않았다.,"{'word':'고르바초프','start_idx':9,'end_idx':13,'type':'PER'}","{'word':'모스크바','start_idx':16,'end_idx':19,'type':'ORG'}",no_relation
346,스타로빌스크 전투는 2022년 러시아의 우크라이나 침공 기간인 2022년 2월 25일에 시작된 진행 중인 군사 교전이다.,"{'word':'스타로빌스크 전투','start_idx':0,'end_idx':8,'type':'EVE'}","{'word':'2022년 2월 25일','start_idx':35,'end_idx':46,'type':'DAT'}",eve:date
347,2012년 유럽 연합은 노벨 평화상을 수상하기도 했다.,"{'word':'2012년','start_idx':0,'end_idx':4,'type':'ORG'}","{'word':'유럽 연합','start_idx':6,'end_idx':10,'type':'ORG'}",no_relation
348,호스토멜 공항 전투 또는 안토노프 국제공항 전투()는 2022년 2월 24일 러시아의 우크라이나 침공 당시 벌어진 전투이다.,"{'word':'호스토멜 공항 전투','start_idx':0,'end_idx':9,'type':'EVE'}","{'word':'2022년 2월 24일','start_idx':30,'end_idx':41,'type':'DAT'}",eve:date
349,인도 국가안보고문관 시브산카르 메논은 러시아가 크림 공화국에 적법한 이해관계를 갖고 있으며 지속적인 외교적 노력과 건설적인 대화가 위기 해결의 열쇠라고 지적했다.,"{'word':'시브산카르 메논','start_idx':11,'end_idx':18,'type':'PER'}","{'word':'국가안보고문관','start_idx':3,'end_idx':9,'type':'POH'}",per:title
350,"개신교는 12%를 차지하는 반면 천주교는 48%의 EU 시민을 차지, 유럽 연합에서 가장 큰 기독교 교파였다.","{'word':'개신교','start_idx':0,'end_idx':2,'type':'ORG'}","{'word':'천주교','start_idx':18,'end_idx':20,'type':'ORG'}",no_relation
351,"인민대표대회는 찬성 339표, 반대 5표로 7월 16일을 우크라이나 국경일로 선포하였다.","{'word':'인민대표대회','start_idx':0,'end_idx':5,'type':'ORG'}","{'word':'우크라이나','start_idx':32,'end_idx':36,'type':'ORG'}",no_relation
352,여기에 크렘린을 포함한 소련 정부의 잔재들을 인수하기 시작한 옐친과도 충돌을 빚었다.,"{'word':'옐친','start_idx':34,'end_idx':35,'type':'PER'}","{'word':'크렘린','start_idx':4,'end_idx':6,'type':'ORG'}",no_relation
353,"1995년에는 스웨덴, 오스트리아, 핀란드가, 2004년 5월 1일에는 라트비아, 리투아니아, 몰타, 슬로바키아, 슬로베니아, 에스토니아, 체코, 키프로스, 폴란드, 헝가리가 가입했으며, 2007년 1월 1일에는 루마니아, 불가리아가 가입했다.","{'word':'오스트리아','start_idx':13,'end_idx':17,'type':'ORG'}","{'word':'폴란드','start_idx':88,'end_idx':90,'type':'ORG'}",no_relation
354,"러시아 국방부에 따르면, 약 20대의 헬리콥터가 작전에 투입되고 전투가 진행되는 동안 200명의 우크라이나군이 사망했으며 러시아군은 사상자가 없는 것으로 파악됐다.","{'word':'러시아 국방부','start_idx':0,'end_idx':6,'type':'ORG'}","{'word':'헬리콥터','start_idx':21,'end_idx':24,'type':'ORG'}",org:property
355,또한 고르바초프는 연방내각을 해체시키고 핵무기 권한을 포함한 권력 거의 대부분을 옐친에게 양도하였다.,"{'word':'고르바초프','start_idx':3,'end_idx':7,'type':'PER'}","{'word':'옐친','start_idx':45,'end_idx':46,'type':'PER'}",no_relation
356,우크라니아 국방부는 비행장이 너무 심하게 훼손되어 러시아군이 사용할 수 없다고 주장했다.,"{'word':'러시아군','start_idx':28,'end_idx':31,'type':'ORG'}","{'word':'비행장','start_idx':11,'end_idx':13,'type':'ORG'}",no_relation
357,"이후 무장 세력이 크림반도 내 주요 시설을 점거하였고, 러시아 정부는 크림반도와 인근 러시아 군사 기지에 러시아 군을 추가 파병하였다.","{'word':'러시아 정부','start_idx':31,'end_idx':36,'type':'ORG'}","{'word':'러시아 군사 기지','start_idx':48,'end_idx':56,'type':'ORG'}",org:property
358,"11월 30일 아침부터 시작된 정부군의 증가하는 폭력 때문에, 시위대는 12월 1일, 12월 8일 키이우에 40만~80만명이 모이면서 계속 증가하고 있다.","{'word':'키이우','start_idx':55,'end_idx':57,'type':'ORG'}","{'word':'정부군','start_idx':17,'end_idx':19,'type':'ORG'}",no_relation
359,겨울은 흑해 인근 지방이라면 따뜻하지만 내륙으로 들어갈수록 대체로 추워진다.,"{'word':'흑해','start_idx':4,'end_idx':5,'type':'ORG'}","{'word':'내륙','start_idx':22,'end_idx':23,'type':'ORG'}",no_relation
360,"당시 러시아 주권을 상징적으로 보여주던, 러시아 연방 의회와 옐친의 사무실이 있던 모스크바 백악관 앞에 모스크바 시민 수천명이 에워싸여 지켰다.","{'word':'모스크바 백악관','start_idx':46,'end_idx':53,'type':'ORG'}","{'word':'러시아 연방 의회','start_idx':23,'end_idx':31,'type':'ORG'}",no_relation
361,"인도와 파키스탄, 조선민주주의인민공화국은 그 어떠한 눈치도 보지 않고 마음껏 핵실험을 하여 핵무기 개발에 성공하였으며, 이스라엘과 조선민주주의인민공화국은 핵무기를 보유하고 있는 것으로 알려졌다.","{'word':'조선민주주의인민공화국','start_idx':10,'end_idx':20,'type':'ORG'}","{'word':'핵무기','start_idx':86,'end_idx':88,'type':'ORG'}",org:property
362,1991년 소련 해체와 함께 독립하였다.,"{'word':'소련 해체','start_idx':6,'end_idx':10,'type':'EVE'}","{'word':'1991년','start_idx':0,'end_idx':4,'type':'DAT'}",eve:date
363,"2월 26일, 수미의 거리에서 전투가 다시 벌어졌다.","{'word':'수미','start_idx':8,'end_idx':9,'type':'ORG'}","{'word':'2월 26일','start_idx':0,'end_idx':5,'type':'DAT'}",no_relation
364,1923년 소비에트 연방 헌법의 적용을 받았다.,"{'word':'소비에트 연방','start_idx':6,'end_idx':12,'type':'ORG'}","{'word':'1923년','start_idx':0,'end_idx':4,'type':'DAT'}",no_relation
365,미·소 초안의 심의를 맡았던 제네바 군축위원회에서는 비핵보유국이 특히 비판적이었다.,"{'word':'제네바 군축위원회','start_idx':16,'end_idx':24,'type':'ORG'}","{'word':'미·소','start_idx':0,'end_idx':2,'type':'ORG'}",no_relation
366,"여기에 동맹국이 모인 자발적이고 상호적인 연합이라는, 소련의 연방체제에 대한 기본적으로 정당화된 신화가 탈퇴/독립을 쉽게 만들었다고 주장한다.","{'word':'동맹국','start_idx':4,'end_idx':6,'type':'ORG'}","{'word':'소련','start_idx':30,'end_idx':31,'type':'ORG'}",org:friendly
367,체르니히우 전투 또는 체르니히우 포위전은 2022년 2월 24일 러시아의 우크라이나 침공 당시 벌어진 전투이다.,"{'word':'체르니히우 전투','start_idx':0,'end_idx':7,'type':'EVE'}","{'word':'2022년 2월 24일','start_idx':23,'end_idx':34,'type':'DAT'}",eve:date
368,"의도론적 관점을 주장하는 대표적인 예로는 아치 브라운의 '고르바초프 팩터'(The Gorbachev Factor) 서적으로, 그는 적어도 1985년에서 1988년까진 소련의 정치에서 고르바초프가 주요 세력 중 하나였으며 '사건으로 이끌어지는' 것과는 반대로 정치 개혁과 발전을 주도했다고 주장했다.","{'word':'아치 브라운','start_idx':23,'end_idx':28,'type':'PER'}","{'word':'소련','start_idx':93,'end_idx':94,'type':'ORG'}",no_relation
369,"그 외에도 이란, 태국, 브라질, 독일 등은 핵개발 의혹을 받고 있다.","{'word':'태국','start_idx':10,'end_idx':11,'type':'ORG'}","{'word':'독일','start_idx':19,'end_idx':20,'type':'ORG'}",no_relation
370,"블라디미르 무코멜은 1988-1996년 동안 인종 갈등으로 벌어진 무력 충돌의 사망자수는 10만명에 달하고, 난민은 최소 500만명에 이른다고 집계했다.","{'word':'블라디미르 무코멜','start_idx':0,'end_idx':8,'type':'PER'}","{'word':'1988','start_idx':11,'end_idx':14,'type':'DAT'}",no_relation
371,"우크라이나 통계청은 2013년 11월에 작년 같은 달에 비해 2013년 10월 우크라이나 산업 생산이 4.9% 감소했고, 2013년 9월 대비 5.6%, 2013년 8월 대비 5.4%(2012년 우크라이나 총 산업 생산량 대비 1.8% 감소)라고 발표했다.","{'word':'우크라이나 통계청','start_idx':0,'end_idx':8,'type':'ORG'}","{'word':'우크라이나','start_idx':44,'end_idx':48,'type':'ORG'}",org:member_of
372,10월 1일엔 이전 정권의 잔재라고 비판받은 크라우츠크와 총리 비탈리 마솔에게 사직하라는 대중 시위가 열린 가운데 의회가 열렸다.,"{'word':'대중 시위','start_idx':50,'end_idx':54,'type':'EVE'}","{'word':'10월 1일','start_idx':0,'end_idx':5,'type':'DAT'}",eve:date
373,"빈곤 및 경제적 불평등 문제도 심해져서, 1988년-1989년, 1933년-1995년 사이 구 소련 국가의 지니 계수는 평균 9% 정도 상승했다.","{'word':'구 소련 국가','start_idx':51,'end_idx':57,'type':'ORG'}","{'word':'1988년','start_idx':23,'end_idx':27,'type':'DAT'}",no_relation
374,"쿠데타 조직은 대중들의 지지를 받을 것이라 생각했지만, 각 공화국과 대도시, 특히 모스크바에서도 대규모 시위와 파업을 열고 쿠데타에 동참하지 않는 모습을 보였다.","{'word':'쿠데타 조직','start_idx':0,'end_idx':5,'type':'ORG'}","{'word':'모스크바','start_idx':46,'end_idx':49,'type':'LOC'}",no_relation
375,"오후 2시 25분(UTC+2), 러시아 국방부는 체르니히우를 포위하고 도시를 봉쇄하고 있다고 발표했다.","{'word':'체르니히우','start_idx':27,'end_idx':31,'type':'ORG'}","{'word':'러시아 국방부','start_idx':18,'end_idx':24,'type':'ORG'}",org:hostile
376,2월 25일 벨라루스에서 진격하는 러시아 지상군으로 구성된 두 번째 공격은 교전 끝에 공항이 러시아에게 점령되었다.,"{'word':'러시아 지상군','start_idx':19,'end_idx':25,'type':'ORG'}","{'word':'러시아','start_idx':52,'end_idx':54,'type':'ORG'}",org:member_of
377,"1990년 1월 21일, 키예프, 리비우, 이바노프란키우스크에서 1918년 우크라이나 독립과 1년 후인 우크라이나 통일의 날을 기념하며 480km에 달하는 인간 사슬을 만드는 시위를 열었다.","{'word':'우크라이나 독립','start_idx':42,'end_idx':49,'type':'EVE'}","{'word':'1990년 1월 21일','start_idx':0,'end_idx':11,'type':'DAT'}",no_relation
378,고르바초프는 이 때까지도 공식적인 입장을 밝히진 않았으나 이전에 독립국가연합이 실제로 수립되면 즉각 사임할 것이라 말했다.,"{'word':'고르바초프','start_idx':0,'end_idx':4,'type':'PER'}","{'word':'독립국가연합','start_idx':36,'end_idx':41,'type':'ORG'}",no_relation
379,9월 5일엔 고르바초프가 남아있는 공화국의 최고위직들이 모여 총리를 추대해 지배할 수 있는 소련 국가위원회 조직을 만들었다. 하지만 이 기관은 제대로 기능하지 못했으며 사실상 이반 실라예프를 위시한 소련 국민경제관리위원회와 국가간경제위원회가 지휘하였고 이들은 실라예프 내각을 세워 급속히 줄어든 권력에서 어떻게든 행정을 유지하러 했다.,"{'word':'소련 국가위원회 조직','start_idx':51,'end_idx':61,'type':'ORG'}","{'word':'고르바초프','start_idx':7,'end_idx':11,'type':'PER'}",org:top_members/employees
380,이 봉기는 키르기스 전역으로 퍼져 키르기스 공화국 수도인 프룬제에도 공산당 본부 점령 시도가 있는 등 키르기스 공화국과 우즈베크 공화국 사이의 내전으로 번졌다.,"{'word':'우즈베크 공화국','start_idx':67,'end_idx':74,'type':'ORG'}","{'word':'키르기스 공화국','start_idx':57,'end_idx':64,'type':'ORG'}",org:hostile
381,"주요 도시로는 키예프, 도네츠크, 드니프로, 하르키우, 리비우, 오데사, 자포리자가 있다. 2014년 러시아가 크림반도를 합병함에 따라 행정력이 크림반도에 미치지 못하지만, 국제사회는 대체로 크림반도를 우크라이나의 일부라는 입장을 견지하고 있다.","{'word':'우크라이나','start_idx':113,'end_idx':117,'type':'ORG'}","{'word':'크림반도','start_idx':107,'end_idx':110,'type':'ORG'}",no_relation
382,1996년 하계 올림픽에서부턴 소련에서 독립한 공화국들이 각 독립국 명의로 참여할 수 있게 되었다.,"{'word':'하계 올림픽','start_idx':6,'end_idx':11,'type':'EVE'}","{'word':'1996년','start_idx':0,'end_idx':4,'type':'DAT'}",eve:date
383,유럽 연합(EU)에서 가장 많이 사용되는 외국어 비율을 계산하면 영어가 인구의 38%로 가장 많고 독일어가 12% 프랑스어가 11% 순으로 나타나고 있다.,"{'word':'유럽 연합','start_idx':0,'end_idx':4,'type':'ORG'}","{'word':'EU','start_idx':6,'end_idx':7,'type':'ORG'}",org:alternate_names
384,"1991년 8월 19일, 소련 부통령 겐나디 야나예프, 총리 발렌틴 파블로프, 국방부 장관 드미트리 야조프, KGB 국장 블라디미르 크류츠코프 및 기타 고위 관리들은 신연방조약 체결을 막기 위해 국가비상사태위원회 조직을 세워 고르바초프 대통령을 크림반도 포로스 별장에 연금시키고 통신선을 전부 끊어버렸다.","{'word':'신연방조약 체결','start_idx':93,'end_idx':100,'type':'EVE'}","{'word':'1991년 8월 19일','start_idx':0,'end_idx':11,'type':'DAT'}",no_relation
385,"대한민국은 1975년 4월 23일 86번째 정식 비준국이 되었고, 조선민주주의인민공화국은 1985년 12월 12일에 가입을 했으나, 1993년 3월 12일 탈퇴를 선언하였다.","{'word':'대한민국','start_idx':0,'end_idx':3,'type':'ORG'}","{'word':'정식 비준국','start_idx':24,'end_idx':29,'type':'ORG'}",org:member_of
386,우크라이나 방위군과 러시아군 사이에 광범위한 시가전이 있었다.,"{'word':'러시아군','start_idx':11,'end_idx':14,'type':'ORG'}","{'word':'우크라이나 방위군','start_idx':0,'end_idx':8,'type':'ORG'}",org:hostile
387,그러나 시브산카르는 인도 내각의 속하는 것이 아니어서 인도 정부의 공식 입장으로 보이기는 어렵다.,"{'word':'인도','start_idx':11,'end_idx':12,'type':'ORG'}","{'word':'시브산카르','start_idx':4,'end_idx':8,'type':'PER'}",no_relation
