,sentence,subject_entity,object_entity,label
165,"10월 17일엔 마솔이 사임했으며, 10월 20일엔 므스티슬라우 총대주교가 46년간 이어졌던 소련의 추방령에서 풀어나 우크라이나에 도착해 키예프 성 소피아 대성당에 입성했다.","{'word':'므스티슬라우','start_idx':29,'end_idx':34,'type':'PER'}","{'word':'총대주교','start_idx':36,'end_idx':39,'type':'POH'}",per:title
166,2월 9일엔 우크라이나 법무부가 루흐 정선을 정식 단체로 승인했다. 하지만 3월 4일 열릴 총선에 루흐 전선이 후보자를 등록하기엔 이미 너무 늦은 후였다.,"{'word':'루흐 정선','start_idx':18,'end_idx':22,'type':'ORG'}","{'word':'법무부','start_idx':13,'end_idx':15,'type':'ORG'}",no_relation
167,"오전 3시 27분(UTC+2), 러시아 제11근위공중강습여단의 대위와 상병이 체르니히우 근교에서 우크라이나군에 항복했다.","{'word':'러시아','start_idx':18,'end_idx':20,'type':'ORG'}","{'word':'제11근위공중강습여단','start_idx':22,'end_idx':32,'type':'ORG'}",org:property
168,8월에서 12월 사이 10개 공화국이 또 다른 쿠데타의 공포로 독립을 선언했다.,"{'word':'공화국','start_idx':16,'end_idx':18,'type':'ORG'}","{'word':'8월','start_idx':0,'end_idx':1,'type':'DAT'}",no_relation
169,"자포리자, 수미, 드니프로페트로우스크 등 러시아어권에서 시위대가 정부 청사를 점령하려 시도하고 있으나, 경찰 및 군병력의 강한 저항에 부딪히고 있다.","{'word':'시위대','start_idx':31,'end_idx':33,'type':'ORG'}","{'word':'군병력','start_idx':63,'end_idx':65,'type':'ORG'}",org:hostile
170,유럽 연합의 기원은 1946년 9월 19일 영국 수상 윈스턴 처칠이 스위스의 취리히에서 한 유명한 유럽에 관한 연설에까지 거슬러 올라간다.,"{'word':'윈스턴 처칠','start_idx':30,'end_idx':35,'type':'PER'}","{'word':'수상','start_idx':27,'end_idx':28,'type':'POH'}",per:title
171,"야로시에 따르면, 우익 섹터는 내무부 및 보안부의 은퇴한 임원들을 모집하고 있다고 밝혔다.","{'word':'야로시','start_idx':0,'end_idx':2,'type':'PER'}","{'word':'내무부','start_idx':17,'end_idx':19,'type':'ORG'}",no_relation
172,"앙겔라 메르켈 독일 총리는 이번 사태로 독일-러시아 간 경제 활동이 급격히 축소되겠지만 그럼에도 불구하고 정치, 경제적으로 러시아가 득 볼 것이 없을 것이라며 경고했다.","{'word':'앙겔라 메르켈','start_idx':0,'end_idx':6,'type':'PER'}","{'word':'총리','start_idx':11,'end_idx':12,'type':'POH'}",per:title
173,우익 섹터는 제2차 세계 대전 당시 추축군 및 소련군 모두에게 맞서 싸웠던 우크라이나 반란군과 같은 여러 우크라이나 파르티잔으로부터 시작되었다고 보고 있다.,"{'word':'소련군','start_idx':26,'end_idx':28,'type':'ORG'}","{'word':'우크라이나 반란군','start_idx':42,'end_idx':50,'type':'ORG'}",org:hostile
174,한편 우크라이나 당국은 우크라이나군이 최소 6대의 GAZ Tigr-Ms를 포함해 하르키우에 진입한 러시아 군용 차량의 절반을 파괴했다고 주장했다.,"{'word':'우크라이나','start_idx':3,'end_idx':7,'type':'ORG'}","{'word':'GAZ Tigr-Ms','start_idx':28,'end_idx':38,'type':'ORG'}",no_relation
175,유럽 연합의 언어는 가입국 각각의 공용어로 정해져 있어서 2013년 7월 1일 이후에는 총 공용어 수가 24개나 된다.,"{'word':'가입국','start_idx':11,'end_idx':13,'type':'ORG'}","{'word':'유럽 연합','start_idx':0,'end_idx':4,'type':'ORG'}",org:member_of
176,"본디, 핵 확산 금지 조약은 25년 기한이었으나 1995년 5월 11일, 뉴욕에서의 평가회의에서 서명국이 합의하여 조약을 조건없이 무기한 연장하기로 결정했다.","{'word':'뉴욕','start_idx':41,'end_idx':42,'type':'ORG'}","{'word':'서명국','start_idx':54,'end_idx':56,'type':'ORG'}",no_relation
177,이 사건으로 국제 사회에서 소련의 입장이 악화되었으며 리투아니아의 저항은 더욱 거세졌다.,"{'word':'리투아니아','start_idx':30,'end_idx':34,'type':'ORG'}","{'word':'소련','start_idx':15,'end_idx':16,'type':'ORG'}",org:hostile
178,"우크라이나 크림 자치 공화국 일대에서는 키예프에서 일어난 혁명에 반대하고 러시아와의 유대 또는 통합에 찬성하는 친러시아계 사람들이 이에 반대하는 시위가 일어났으며, 이에 반해 친우크라이나계 시민들은 혁명에 찬성하고 있다.","{'word':'우크라이나','start_idx':0,'end_idx':4,'type':'ORG'}","{'word':'러시아','start_idx':41,'end_idx':43,'type':'ORG'}",no_relation
179,1990년 2월 12일에서 14일 사이 타지크 소비에트 사회주의 공화국의 수도인 두샨베에서 타지크인과 강제이주된 아르메니아인 간 민족갈등이 터져 반아르메니아 민족분규인 대봉기가 일어났다.,"{'word':'반아르메니아 민족분규','start_idx':81,'end_idx':91,'type':'EVE'}","{'word':'1990년 2월 12일','start_idx':0,'end_idx':11,'type':'DAT'}",eve:date
180,러시아-우크라이나 국경에서 남쪽으로 32km 떨어진 곳에 위치하며 러시아어 화자가 다수를 차지하고 있는 도시인 하르키우는 우크라이나에서 두 번째로 큰 도시로 러시아군의 주요 표적으로 여겨지고 있다.,"{'word':'하르키우','start_idx':62,'end_idx':65,'type':'ORG'}","{'word':'우크라이나','start_idx':68,'end_idx':72,'type':'ORG'}",org:member_of
181,그러나 우크라이나 군인과 민병대가 도시 내에서 러시아군과 교전하기 시작하면서 격렬한 시가전이 벌어졌다.,"{'word':'우크라이나 군인','start_idx':4,'end_idx':11,'type':'ORG'}","{'word':'러시아군','start_idx':26,'end_idx':29,'type':'ORG'}",org:hostile
182,영국은 러시아 자금이 대거 몰려있으며 프랑스는 상륙함 2척 수출 계약을 한 상태다.,"{'word':'러시아','start_idx':4,'end_idx':6,'type':'ORG'}","{'word':'프랑스','start_idx':21,'end_idx':23,'type':'ORG'}",no_relation
183,또한 같은 날엔 캐나다가 우크라이나계 캐나다인인 네스토르 하요우스키를 키예프 총영사로 파견한다고 발표했다.,"{'word':'네스토르 하요우스키','start_idx':27,'end_idx':36,'type':'PER'}","{'word':'총영사','start_idx':43,'end_idx':45,'type':'POH'}",per:title
184,한편 러시아 국방부 대변인 이고르 코나셴코프는 러시아군이 우크라이나 제302대공미사일연대의 항복을 받고 471명의 우크라이나 군인을 생포했다고 밝혔다.,"{'word':'러시아군','start_idx':26,'end_idx':29,'type':'ORG'}","{'word':'우크라이나','start_idx':32,'end_idx':36,'type':'ORG'}",org:hostile
185,"12월 25일 저녁 7시, 고르바초프는 전국 텔레비전 연설을 통해 ""난 소비에트 사회주의 공화국 연방의 대통령직으로써의 활동을 중지한다""라고 말하면서 대통령직 사임을 밝혔다.","{'word':'대통령직 사임','start_idx':84,'end_idx':90,'type':'EVE'}","{'word':'12월 25일','start_idx':0,'end_idx':6,'type':'DAT'}",eve:date
186,"7월 23일, 투표를 통해 국회 의장으로 레오니드 크라우추크가 선출되었다.","{'word':'레오니드 크라우추크','start_idx':23,'end_idx':32,'type':'PER'}","{'word':'의장','start_idx':18,'end_idx':19,'type':'POH'}",per:title
187,비는 북서부 지방에 가장 많이 내리고 동부와 남동부 지역은 덜 오는 편이다.,"{'word':'남동부 지역','start_idx':25,'end_idx':30,'type':'ORG'}","{'word':'북서부 지방','start_idx':3,'end_idx':8,'type':'ORG'}",no_relation
188,"1990년 12월 초엔 우크라이나 민주혁명당이 창당했으며, 12월 15일엔 우크라이나 민주당이 창당했다.","{'word':'민주당','start_idx':48,'end_idx':50,'type':'ORG'}","{'word':'민주혁명당','start_idx':19,'end_idx':23,'type':'ORG'}",no_relation
189,"핵확산을 막기 위해 비핵국가들은 핵무기 개발이나 획득이 절대 금지되고 안전조치제도에 의한 사찰을 받아야 하는 반면, 핵국가들은 단지 점진적인 핵무기 감축에 노력하는 것만이 요구되고 있다.","{'word':'핵국가','start_idx':65,'end_idx':67,'type':'ORG'}","{'word':'핵무기','start_idx':79,'end_idx':81,'type':'ORG'}",org:property
190,"리투아니아 대통령의 지지하에, 미국 정부는 우크라이나의 주권을 훼손한 데에 따른 대러시아 제재에 착수했다.","{'word':'리투아니아','start_idx':0,'end_idx':4,'type':'ORG'}","{'word':'미국','start_idx':17,'end_idx':18,'type':'ORG'}",no_relation
191,"공용어는 우크라이나어 및 러시아어가 쓰이고, 국민의 절대다수가 믿는 종교는 우크라이나 정교회이다.","{'word':'국민','start_idx':25,'end_idx':26,'type':'PER'}","{'word':'우크라이나 정교회','start_idx':42,'end_idx':50,'type':'ORG'}",no_relation
192,"이에 대해 우크라이나 과도정부는 내부 문제에 개입하는 러시아에 대해 비판하고, 러시아는 우크라이나의 협정에 따른 것이라며 반박하였다.","{'word':'러시아','start_idx':44,'end_idx':46,'type':'ORG'}","{'word':'우크라이나','start_idx':49,'end_idx':53,'type':'ORG'}",no_relation
193,그러나 규약에 따라 탈퇴 선언 발효에 필요한 3개월이 지나기 직전인 1993년 6월 11일 조미공동성명에 따라 탈퇴를 일방적으로 유보하였다.,"{'word':'탈퇴 선언','start_idx':11,'end_idx':15,'type':'EVE'}","{'word':'1993년 6월 11일','start_idx':38,'end_idx':49,'type':'DAT'}",no_relation
194,1월 23일엔 우크라이나 그리스 가톨릭교회가 1946년 소비에트에게 탄압당한 뒤 처음으로 시노드(종교 회의)를 열었다.,"{'word':'시노드','start_idx':50,'end_idx':52,'type':'EVE'}","{'word':'1월 23일','start_idx':0,'end_idx':5,'type':'DAT'}",eve:date
195,"3월 18일에는 블라디미르 푸틴 러시아 대통령과 세르게이 악쇼노프 크림 공화국 총리, 블라디미르 콘스탄티노프 크림 공화국 최고회의 의장, 알렉세이 찰리 세바스토폴 시장이 러시아-크림 공화국 병합 조약에 서명하였으며, 3월 19일에는 러시아 헌법 재판소가 이 조약이 합법이라고 판결내렸다.","{'word':'세르게이 악쇼노프','start_idx':27,'end_idx':35,'type':'PER'}","{'word':'총리','start_idx':44,'end_idx':45,'type':'POH'}",per:title
196,양군의 교전은 현지 시각으로 지난 2월 24일 오후 10시 30분쯤 우크라이나 제27포병여단이 주둔하고 있는 수미주립대학교 인근에서 계속됐다.,"{'word':'우크라이나 제27포병여단','start_idx':38,'end_idx':50,'type':'ORG'}","{'word':'수미주립대학교','start_idx':61,'end_idx':67,'type':'LOC'}",no_relation
197,3월 21일 블라디미르 푸틴 대통령이 (러시아-크림 공화국 병합 문서)에 대해서 최종 서명하였다.,"{'word':'블라디미르 푸틴','start_idx':7,'end_idx':14,'type':'PER'}","{'word':'대통령','start_idx':16,'end_idx':18,'type':'POH'}",per:title
198,소련 붕괴의 최종장은 1991년 12월 1일 열린 우크라이나 독립 투표였다.,"{'word':'우크라이나 독립 투표','start_idx':28,'end_idx':38,'type':'EVE'}","{'word':'1991년 12월 1일','start_idx':12,'end_idx':23,'type':'DAT'}",eve:date
199,"또한 이 봉기에 책임을 지고 타지크 공산당 제1서기, 최고회의 의장, 수상 등 수뇌부 전원이 사임하였다.","{'word':'타지크','start_idx':16,'end_idx':18,'type':'PER'}","{'word':'제1서기','start_idx':24,'end_idx':27,'type':'POH'}",per:title
200,러시아 공화국의 대통령인 옐친은 쿠데타 세력을 비판하고 쿠데타에 동조하지 말라고 연설하면서 대중들의 지지를 받았다.,"{'word':'러시아 공화국','start_idx':0,'end_idx':6,'type':'ORG'}","{'word':'쿠데타 세력','start_idx':18,'end_idx':23,'type':'ORG'}",no_relation
201,수미 전투는 2022년 2월 24일 러시아의 우크라이나 침공 당시 벌어진 전투이다.,"{'word':'수미 전투','start_idx':0,'end_idx':4,'type':'EVE'}","{'word':'2022년 2월 24일','start_idx':7,'end_idx':18,'type':'DAT'}",eve:date
202,"2016년 우크라이나에서 시행한 같은 여론조사에 따르면 소련 붕괴의 여파의 휴유증을 겪은 시민들 중 30%만 붕괴를 후회했고, 50%는 후회하지 않는다고 밝혔다.","{'word':'여론조사','start_idx':21,'end_idx':24,'type':'EVE'}","{'word':'2016년','start_idx':0,'end_idx':4,'type':'DAT'}",eve:date
203,"에드가르 사비사르가 소련군과 10분간 대치한 후, 에스토니아인에 대해 저항하다 실패하고 이내 탈린에서 물러났다.","{'word':'에드가르 사비사르','start_idx':0,'end_idx':8,'type':'PER'}","{'word':'탈린','start_idx':52,'end_idx':53,'type':'LOC'}",no_relation
204,북대서양 조약기구 또한 크림 공화국과 일대에 긴장감이 높아지고 있음을 지적하며 러시아에 대한 비판 수위를 높였고 유럽위원회는 우크라이나 내부의 결속력을 다지는 데 모든 지원을 아끼지 않겠다고 성명을 냈다.,"{'word':'유럽위원회','start_idx':63,'end_idx':67,'type':'ORG'}","{'word':'우크라이나','start_idx':70,'end_idx':74,'type':'ORG'}",org:friendly
205,6월 5일에서 6일 사이엔 미국에 있는 미국 우크라이나 정교회의 므스티슬라우가 우크라이나 독립정교회의 첫 시노드에서 총대주교 자리로 선출되었다.,"{'word':'미국 우크라이나 정교회','start_idx':22,'end_idx':33,'type':'ORG'}","{'word':'므스티슬라우','start_idx':36,'end_idx':41,'type':'PER'}",org:top_members/employees
206,"유럽의 공동체를 창립한 것으로 알려진 회원국은 벨기에, 프랑스, 이탈리아, 네덜란드, 룩셈부르크, 독일(서독) 6개국으로, 이들을 합쳐 이너 식스라고 부른다.","{'word':'프랑스','start_idx':31,'end_idx':33,'type':'ORG'}","{'word':'이너 식스','start_idx':76,'end_idx':80,'type':'ORG'}",org:member_of
207,"2013년 12월 설문조사(서로 다른 3개 회사의 조사)에 따르면, 우크라이나인들의 45%~50%가 유로마이단을 지지하고 있으며, 42%~50%가 반대하고 있다고 나타났다.","{'word':'회사','start_idx':24,'end_idx':25,'type':'ORG'}","{'word':'우크라이나인','start_idx':38,'end_idx':43,'type':'ORG'}",no_relation
208,"4월 6일, 리비우 시의회가 성 게오르기우스 성당을 우크라이나 그리스 가톨릭교회로 개종하는 안건을 냈다.","{'word':'그리스 가톨릭교회','start_idx':35,'end_idx':43,'type':'ORG'}","{'word':'성 게오르기우스 성당','start_idx':16,'end_idx':26,'type':'ORG'}",no_relation
209,연금되었던 고르바초프도 소형 트랜지스터 라디오를 통해 BBC 월드 서비스 라디오를 청취하며 소식을 들을 수 있었다.,"{'word':'고르바초프','start_idx':6,'end_idx':10,'type':'PER'}","{'word':'BBC 월드 서비스 라디오','start_idx':30,'end_idx':43,'type':'POH'}",no_relation
210,"이전의 유럽 안보 협력 기구나 유럽 평의회, 서유럽 연합 등도 의회를 가지고 있었지만 모두 회원국의 의회에 의해 임명되었다. 하지만 유럽 의회는 1979년 이래 유일하게 시민들에 의해 직접 선출되고 있다.","{'word':'유럽 안보 협력 기구','start_idx':4,'end_idx':14,'type':'ORG'}","{'word':'유럽 평의회','start_idx':17,'end_idx':22,'type':'ORG'}",no_relation
211,"이후 2월 25일, 러시아군은 다시 한번 안토노프스키 다리를 점령하고, 헤르손도 점령했다.","{'word':'러시아군','start_idx':11,'end_idx':14,'type':'ORG'}","{'word':'헤르손','start_idx':40,'end_idx':42,'type':'ORG'}",org:hostile
212,오전 8시 34분(UTC+2)에 우크라이나군은 체르니히우에서 러시아군의 공격을 격퇴하고 러시아군의 장비와 문서를 탈취했다.,"{'word':'우크라이나군','start_idx':18,'end_idx':23,'type':'ORG'}","{'word':'러시아군','start_idx':34,'end_idx':37,'type':'ORG'}",org:hostile
213,국제 원자력 기구 (IAEA)는 이 조약에 가입된 비핵무장 국가만을 대상으로 원자력시설 감시를 정기 및 수시로 실시하고 있다.,"{'word':'국제 원자력 기구','start_idx':0,'end_idx':8,'type':'ORG'}","{'word':'IAEA','start_idx':11,'end_idx':14,'type':'ORG'}",org:alternate_names
214,"선거 결과 350석 중 280석이 공산당 후보였으며 45석만 인민전선 및 기타 비공산계 정당이 획득했으며 이들은 ""민주 선거블록""을 만들었다.","{'word':'비공산계 정당','start_idx':44,'end_idx':50,'type':'ORG'}","{'word':'민주 선거블록','start_idx':64,'end_idx':70,'type':'ORG'}",no_relation
215,반대로 브릭스 5개국은 헤이그에서 열린 핵안보정상회의 때 별도 회동을 통하여 G20에 러시아가 참여하도록 해야 한다며 러시아 옹호에 나섰다.,"{'word':'핵안보정상회의','start_idx':22,'end_idx':28,'type':'EVE'}","{'word':'헤이그','start_idx':13,'end_idx':15,'type':'LOC'}",eve:place
216,"신연방조약에 대한 개혁주의자들의 미적지근한 반응에 반해 소련군과 소련 군산복합체, 국가보안위원회(KGB), 소련 공산당 내에서 여전히 강한 세력을 가지고 있던 보수파, 소련의 러시아 국가주의자, 소련의 러시아 민족주의자 등은 소비에트 국가와 중앙집중화된 권력구조를 건드리는 것에 격렬하게 반발했다.","{'word':'국가보안위원회','start_idx':46,'end_idx':52,'type':'ORG'}","{'word':'KGB','start_idx':54,'end_idx':56,'type':'ORG'}",org:alternate_names
217,"12월 8일엔 러시아, 우크라이나, 벨라루스 3개 공화국의 정상이 벨라루스 서부의 비아워비에자 숲에서 비밀리에 만나 소련은 여러 이유로 더 이상 존재하지 않는다 선언하고 이를 독립국가연합(CIS)가 이어받았다고 합의한 벨라베자 조약에 서명했다.","{'word':'독립국가연합','start_idx':98,'end_idx':103,'type':'ORG'}","{'word':'CIS','start_idx':105,'end_idx':107,'type':'ORG'}",org:alternate_names
218,학생들은 키예프 독립광장에서 농성을 벌이면서 시위를 계속했다.,"{'word':'학생들','start_idx':0,'end_idx':2,'type':'PER'}","{'word':'키예프 독립광장','start_idx':5,'end_idx':12,'type':'ORG'}",no_relation
219,우익 섹터는 우크라이나 혁명의 여파로 몇몇 무기를 새로운 우크라이나 정부에게 제공했지만 나머지는 계속 소유하고 있다.,"{'word':'우크라이나 정부','start_idx':32,'end_idx':39,'type':'ORG'}","{'word':'우익 섹터','start_idx':0,'end_idx':4,'type':'ORG'}",no_relation
220,"1991년 12월 24일, 러시아 연방의 대통령 보리스 옐친은 유엔 사무총장에게 서한을 보내 안보리 상임이사국을 포함한 소련의 모든 유엔 회원국 권리를 러시아가 승계한다는 결정을 독립국가연합의 기타 11개국이 지지한다는 통보를 보냈다.","{'word':'보리스 옐친','start_idx':27,'end_idx':32,'type':'PER'}","{'word':'대통령','start_idx':23,'end_idx':25,'type':'POH'}",per:title
221,알마아타 조약에선 유엔 회원국 여부를 포함한 여러 문제도 다루었다.,"{'word':'알마아타 조약','start_idx':0,'end_idx':6,'type':'EVE'}","{'word':'유엔','start_idx':10,'end_idx':11,'type':'ORG'}",no_relation
222,가장 시위대를 지지하고 있는 지역은 키이우(75% 지지)와 서부 우크라이나(80% 지지)로 나타났다.,"{'word':'키이우','start_idx':20,'end_idx':22,'type':'ORG'}","{'word':'서부 우크라이나','start_idx':33,'end_idx':40,'type':'ORG'}",no_relation
223,"크림 위기(, )는 2014년 우크라이나 혁명으로 빅토르 야누코비치가 탄핵되고 올렉산드르 투르치노프가 임시대통령(권한대행)을 맡은 이후에 우크라이나의 크림반도 지역에 불어닥친 여파이다.","{'word':'올렉산드르 투르치노프','start_idx':44,'end_idx':54,'type':'PER'}","{'word':'임시대통령','start_idx':57,'end_idx':61,'type':'POH'}",per:title
224,"러시아 정부는 2월 28일, 우크라이나 크림반도의 러시아 군사 기지에 2000여명의 군을 추가 파병하였고, 우크라이나의 올렉산드르 투르치노프 대통령 대행은 이를 침공으로 규정하며 군의 철수를 요구하였다.","{'word':'올렉산드르 투르치노프','start_idx':67,'end_idx':77,'type':'PER'}","{'word':'대통령 대행','start_idx':79,'end_idx':84,'type':'POH'}",per:title
225,"전 세계 인구의 7.3%을 차지하는 유럽 연합의 2017년 기준 국내총생산은 19조 6700억 달러로, 전세계 GDP의 24.6%를 차지한다.","{'word':'유럽 연합','start_idx':20,'end_idx':24,'type':'ORG'}","{'word':'세계','start_idx':2,'end_idx':3,'type':'ORG'}",org:member_of
226,"월스트리트저널은 3월 23일 북대서양조약기구(나토) 고위 관계자의 말을 인용해 ""러시아가 우크라이나 접경 지대에 대규모 군대를 배치했으며 이는 몰도바에 큰 위협이 되고 있다""고 밝혔다.","{'word':'러시아','start_idx':45,'end_idx':47,'type':'ORG'}","{'word':'몰도바','start_idx':80,'end_idx':82,'type':'ORG'}",org:hostile
227,"한편, 폴란드의 총리 도날드 투스크는 독일이 러시아 가스에 많은 양을 의존하는 것과 같은 상황에서 유럽 전체에 위기가 생길 수도 있다며 유럽 연합의 에너지 정책 변화를 촉구했다.","{'word':'도날드 투스크','start_idx':12,'end_idx':18,'type':'PER'}","{'word':'총리','start_idx':9,'end_idx':10,'type':'POH'}",per:title
228,러시아의 합병 소식이 전해진 가운데 미국 및 서방 국가들은 대러시아 제재를 추진하려 하고 있다.,"{'word':'미국','start_idx':20,'end_idx':21,'type':'ORG'}","{'word':'러시아','start_idx':0,'end_idx':2,'type':'ORG'}",no_relation
229,"크림 위기에 관련해 대한민국 외교부 조태영 대변인은 크림 사태에 대한 질문에 ""3월 18일 안보리 결의안 투표 시 찬성했다""고 말했으나 정해진 것은 없다고 밝혔다.","{'word':'조태영','start_idx':20,'end_idx':22,'type':'PER'}","{'word':'대변인','start_idx':24,'end_idx':26,'type':'POH'}",per:title
230,"2014년 여론조사에 따르면 러시아 시민의 57%가 소련의 붕괴를 후회했으며, 30%가 후회하지 않는다고 답변했다.","{'word':'여론조사','start_idx':6,'end_idx':9,'type':'EVE'}","{'word':'2014년','start_idx':0,'end_idx':4,'type':'DAT'}",eve:date
231,2005년 2월 시행한 유사한 여론조사에선 우크라이나 시민의 50%가 소련 해체를 후회한다고 밝혔다.,"{'word':'여론조사','start_idx':17,'end_idx':20,'type':'EVE'}","{'word':'2005년 2월','start_idx':0,'end_idx':7,'type':'DAT'}",eve:date
232,시위가 계속되면서 우크라이나 대통령 빅토르 야누코비치와 총리 미콜라 아자로프의 사임을 요구하는 목소리가 높아지고 있다.,"{'word':'미콜라 아자로프','start_idx':34,'end_idx':41,'type':'PER'}","{'word':'총리','start_idx':31,'end_idx':32,'type':'POH'}",per:title
233,"영국 국방부에 따르면, 지난 24일 체르니히우를 공격한 러시아군이 도시 외곽에서 정지했다.","{'word':'러시아군','start_idx':31,'end_idx':34,'type':'ORG'}","{'word':'체르니히우','start_idx':20,'end_idx':24,'type':'ORG'}",org:hostile
234,우크라이나는 러시아 혁명 후의 혼란과 끊임,"{'word':'러시아','start_idx':7,'end_idx':9,'type':'ORG'}","{'word':'우크라이나','start_idx':0,'end_idx':4,'type':'ORG'}",no_relation
235,이후 버락 오바마 미국 대통령은 푸틴에게 전화를 걸어 러시아의 군사 행동 중지를 요구하며 위기가 고조되고 있다.,"{'word':'버락 오바마','start_idx':3,'end_idx':8,'type':'PER'}","{'word':'대통령','start_idx':13,'end_idx':15,'type':'POH'}",per:title
236,하자르 카간국의 영향에 따라 동슬라브족으로서의 정체성이 생기기 시작하였고 8세기에서 9세기에 루스 카간국이라는 고대 투르크어인 군주 칭호인 카간을 자칭하는 북게르만족 루스인의 첫 국가가 등장하였다.,"{'word':'동슬라브족','start_idx':16,'end_idx':20,'type':'ORG'}","{'word':'북게르만족','start_idx':87,'end_idx':91,'type':'ORG'}",no_relation
237,"이날 안드리 파루비 우크라이나 국가안보·국방위원회 서기는 예비군 소집이 시작되었으며, 국가안보·국방위원회 결의에 따라 올렉산드르 투르치노프 대통령 대행이 우크라이나 전군에 전투태세 돌입 명령을 내렸다고 밝혔다.","{'word':'올렉산드르 투르치노프','start_idx':66,'end_idx':76,'type':'PER'}","{'word':'대통령 대행','start_idx':78,'end_idx':83,'type':'POH'}",per:title
238,"3월 1일, 러시아 상원 의회는 블라디미르 푸틴 대통령이 요청한 우크라이나 내에서의 군사력 사용안에 대해 만장일치로 통과시켰다.","{'word':'블라디미르 푸틴','start_idx':18,'end_idx':25,'type':'PER'}","{'word':'대통령','start_idx':27,'end_idx':29,'type':'POH'}",per:title
239,유럽 의회는 또한 유럽 집행 위원회를 감독하며 집행 위원 임명 동의를 하며 불신임 투표를 통해 해임할 수 있다.,"{'word':'유럽 집행 위원회','start_idx':10,'end_idx':18,'type':'ORG'}","{'word':'유럽 의회','start_idx':0,'end_idx':4,'type':'ORG'}",org:member_of
